id,keyword,location,text,target,num_char,num_words,avg_word_length,num_hashtags,country
10640,wounds,"Newcastle, England ",like rub salt wound dad,0,71,10,6.2,0,Unknown
5642,flooding,? ,soon start flood comment section come brazil comment bc,0,105,19,4.578947368421052,0,Unknown
7542,oil spill,United Kingdom,la time refugia oil spill costlier big project,1,95,13,6.384615384615385,0,United Kingdom
8483,screamed,'SAN ANTONIOOOOO',scream lung guy come sa prom addtexastonext1dtour,0,140,24,4.833333333333333,1,Unknown
7126,military,"Ewa Beach, HI",hire read late job open resist nur militari program nur,0,135,19,6.157894736842105,3,Unknown
9087,structural failure,,virgin palac crash earli unlock brake trigger structur failur crash virgin palac,1,136,18,6.611111111111111,0,Unknown
9182,suicide bomber,,like video ta 5 suicid stick bomber ta 5 onlin funni moment,0,121,19,5.421052631578948,0,Unknown
10827,wrecked,,wreck,0,49,7,6.142857142857143,0,Unknown
8900,snowstorm,"Huntington, WV",sorri build fire desk alreadi plea maintain snowstorm til arriv,0,141,19,6.421052631578948,0,Unknown
2221,chemical emergency,"Beaumont, TX",emerg crew respond chemic spill downtown beaumont renew,1,90,10,8.1,1,Unknown
9795,trapped,WORLDWIDE!,nz hollywood trap miner rella chile hugomatz,0,91,11,7.363636363636363,2,Unknown
10377,weapons,,pay photo safari weapon allow otherwisethey like kill cometh,0,123,18,5.888888888888889,0,Unknown
7473,obliteration,,win kerr 716 obit,0,44,7,5.428571428571429,1,Unknown
659,attack,Dubai,drone attack kill suspect milic north waziristan,1,115,12,8.583333333333334,0,Unknown
1929,burning buildings,,live matter fan burn build steal neighbor protest,1,119,19,5.315789473684211,0,Unknown
6385,hurricane,,mess feel like hurrican damag break home,0,66,12,4.583333333333333,0,Unknown
3180,deluge,London,perhap histori appli delug recent expos childsexabus truli histori scale cover,1,136,21,5.523809523809524,1,Unknown
5963,hazard,,9503 bmw 528 530 540 740 emerg warn hazard switch button oem 20177707d,0,125,15,7.4,0,Unknown
4905,explode,,think tie thunderstorm tho soul explod,0,78,13,5.076923076923077,0,Unknown
7116,military,USA,mike manner discuss trust betray militari veteran environ,0,108,12,8.083333333333334,3,United States
10124,upheaval,Oregon,look state action year ferguson uphold,0,79,11,6.2727272727272725,0,Unknown
2406,collide,,like video duti piano entertain ep 9 musician collid,0,133,19,6.052631578947368,0,Unknown
968,blaze,,total tweet fail beauti insid blaze,0,93,14,5.714285714285714,0,Unknown
3650,destroy,"Virginia, USA",destroy free random honest,1,32,5,5.6,0,United States
3788,destruction,London,angel histori propel futur wind progress leav wake pile death district wb,0,138,24,4.791666666666667,0,Unknown
3216,deluged,,busi delug invoic stand cold r shape like rise pay pile,0,132,26,4.115384615384615,0,Unknown
7728,panicking,"Derbyshire, United Kingdom",peopl final panic tv,0,89,9,9.0,0,United Kingdom
3812,detonate,"Broomfield, CO",boulder deputi wait bomb squad devon grenad like find stearn lake today,1,133,20,5.7,1,"Congo, The Democratic Republic of the"
4957,exploded,,news scienc london warship explod 1665 becaus sailor recycl artilleri cartridg life tech,1,136,16,7.5625,4,Unknown
2565,crash,I-75 in Florida,clear crash hamilton i975 south mm 459,1,51,10,4.2,0,Unknown
1769,buildings burning,"Washington, D.C.",watch hela firefight struggl save burn build night w old equip grate dcf,1,136,21,5.523809523809524,0,Unknown
6897,mass murder,,noth white guy tri mass murder peopl appear reason becaus let guess s mental ill blah blah blah antioch,1,137,24,4.75,1,Unknown
6127,hellfire,"Charleston, WV",hellfir gargoyl hoof coil,0,50,5,9.2,0,Unknown
3192,deluge,,love song heal heredelug want sing church spanish translat,0,143,24,5.0,0,Unknown
7914,rainstorm,Yobe State,rainstorm destroy 600 hous robe state rainstorm destroy 600 hous robe state daili trust damag,1,137,18,6.611111111111111,0,Unknown
4356,earthquake,One World,aftershock big inti earthquak,1,93,14,5.714285714285714,0,Unknown
4341,dust storm,"Atlanta, GA",stay night barrier tp run dust storm pass,1,128,24,4.375,0,Gabon
252,ambulance,West Wales,anyon travel aberystwythshrewsburi right insid servic halt outsid shrew abul scene,1,136,19,6.2105263157894735,0,Unknown
2146,catastrophe,Ylisse,catastroph peopl reckless line friend,0,135,24,4.666666666666667,0,Unknown
5825,hail,,new warn central hill 1 hail 60 mph wind affect sure later tonight kotaweath,1,134,19,6.105263157894737,1,Unknown
7093,meltdown,"Flushing, Queens",lol earthen midst bullen meltdown reach doubl bubbl meet,0,78,13,5.076923076923077,1,Unknown
10256,war zone,In a graveyard ,rip mama hug caus world war zone,0,60,13,3.6923076923076925,0,Unknown
6872,mass murder,,oh usual mass murder world domain plan coffe day,1,87,15,4.866666666666666,0,Unknown
6567,injury,,follownflnew michael flood hand injuri devalu fantasi stock nfl news playoff,0,122,14,7.785714285714286,3,Unknown
8722,sinking,Haarlem,invest news euric green mountain inc quart earn share sink hour stock new,0,139,17,7.235294117647059,0,Unknown
6434,hurricane,,ashley hurrican harbor friday,1,75,11,5.909090909090909,0,Unknown
5339,fire,Zac Newsome loves me,feel like fire,0,30,7,3.4285714285714284,0,Unknown
8504,screaming,tx,intern scream,0,44,5,8.0,0,Unknown
4922,exploded,USA,dress meme offic explod internet,0,79,10,7.0,0,United States
7569,outbreak,"Los Angeles, CA",famili sue legionnair 40 famili affect fatal outbreak legionnair dista,1,136,18,6.611111111111111,0,Central African Republic
9230,suicide bombing,Memphis,kurd suicid attack kill 2 turkish soldier,1,67,8,7.5,0,Unknown
4381,earthquake,,m15 0111 etc km lake henshaw california,1,76,9,7.555555555555555,0,Unknown
7767,police,,oop bounti hunter tri raid phoenix polic chief home group arm bounti,1,137,18,6.666666666666667,0,Unknown
2019,casualties,"Phoenix, AZ",afghanistan un report recordhigh level civilian casualti news afghanistan unit,1,138,15,7.8,0,Azerbaijan
828,battle,California,miss gari use son play dixi electron green fiddl sure postnat celebi sequenc,0,123,20,5.2,0,Unknown
5847,hailstorm,,wick weather roll calgari surround area,1,111,12,8.333333333333334,0,Unknown
7029,mayhem,,ashburi park shoot report,1,73,7,9.571428571428571,0,Unknown
3161,deluge,"Los Angeles, CA",delug resourc flood medic provid cleanup worker,1,123,17,6.294117647058823,1,Central African Republic
5328,fire,Brooklyn,flood fire list,1,72,12,5.0,0,Unknown
3241,deluged,,depart commerc delug month com,0,136,18,6.611111111111111,0,Unknown
8513,screaming,Daddy Kink Central,scream,0,19,2,9.0,0,Unknown
476,armageddon,East Coast,nice gain bail stand prepar toddler apocalyps armageddon,0,107,16,5.75,0,Unknown
883,bioterrorism,"Sydney, New South Wales",anthrax bioterror cdc carri extent review lab safeti pathogen hand procedur,1,126,16,6.9375,2,Unknown
1067,bleeding,Madisonville TN,awesom blue pretti bad,0,59,9,5.666666666666667,0,Unknown
1283,bloody,Ivano-Frankivsk,enter win enter set butterlondon lip crayon enter long,0,121,18,5.777777777777778,2,Unknown
10464,wild fires,"Johannesburg, South Africa",load shed german live like wild camp fire cook fire etc,0,133,26,4.115384615384615,0,South Africa
5013,eyewitness,,remem pittsburgh eyelid histori steel citi len barcouski pb penn,0,126,14,8.071428571428571,0,Unknown
1376,blown up,,leo ass metaphor blow piperwearsthep charm,0,92,11,7.454545454545454,2,Unknown
9220,suicide bombing,USA,turkish troop kill kurdish milic suicid attack,1,81,9,8.11111111111111,0,United States
9673,tornado,Midwest,ok sever thunderstorm warn issu august 05 829pm cdt august 05 915pm cdt news,1,130,20,5.5,1,Unknown
4141,drought,miami,purpl activist think drought,1,58,11,4.363636363636363,0,Unknown
5611,flooding,"Rock Springs, WY",rock spring reid live elk street continu battl flood issu monday rain storm,1,144,19,6.631578947368421,0,Unknown
2301,cliff fall,"Madrid, Comunidad de Madrid",en cilla black die stroke fall spain sir cliff reveal visit spain,0,137,24,4.708333333333333,0,Unknown
9965,tsunami,"Washington, DC",ban thai tsunami sushi washington dc,0,73,11,5.7272727272727275,0,Unknown
9489,terrorism,,onlin homeland secur apprais pakistan anti terrorist act,0,100,10,9.1,3,Unknown
4691,engulfed,,come land engulf tribal war turn land peac ie marina prophetmuhammad islam,0,123,23,4.391304347826087,2,Unknown
7551,outbreak,"New York City, NY",death confirm legionnair outbreak south bronx total case reach trial digit,1,119,15,7.0,0,Unknown
9753,tragedy,,fli tragedi mp live recount horror coach train fling water,1,137,23,5.0,0,Unknown
4171,drown,,hope drown,0,36,6,5.166666666666667,0,Unknown
5548,flattened,Derby,mum later pick new car today flatten batteri alreadi tri sort bluetooth muppet,0,128,22,4.863636363636363,1,Unknown
9373,survived,,dad surviv drive,0,44,8,4.625,0,Unknown
8758,siren,Am International,r u marri oh final jenni ariston marri happi,0,119,18,5.666666666666667,0,Unknown
2953,dead,,joel 228 book act 217,0,56,8,6.125,0,Unknown
4910,explode,,toronto crazi blue jay imagin lead good citi later explod,0,111,20,4.6,0,Unknown
621,arsonist,ss,,0,39,4,9.0,0,Brunei Darussalam
2692,crush,Everywhere,sevenfigz crush,1,45,5,8.2,0,Unknown
3831,detonate,,devon ft mop,0,73,7,9.571428571428571,0,Unknown
4931,exploded,,explod bring begin univel match mention verstehen heaven earth univel,0,140,21,5.571428571428571,0,Unknown
6996,mayhem,,beach read august giveaway hop away book mayhem seri,0,121,17,6.117647058823529,1,Unknown
1213,blizzard,"Washington, USA",plea veri like link,0,73,12,5.166666666666667,0,United States
9987,tsunami,ona block w/ my BOY ??,man stomach feel like tsunami,0,38,8,3.875,0,Unknown
5789,hail,"Carol Stream, Illinois",great michigan techniqu camp big thank blue wrestl,1,129,14,7.928571428571429,2,Unknown
3005,death,UPTOWN ,death ill fore rep jet,1,41,8,4.25,0,Unknown
8431,sandstorm,USA,watch airport swallow sandstorm minut,1,91,14,5.571428571428571,0,United States
5055,eyewitness,,dk eyelid travel guid denmark travel guid bay auction eye,0,113,16,6.125,0,Unknown
3074,deaths,,know happen govt think belief warrant death jap,1,138,24,4.791666666666667,0,Unknown
1450,body bagging,Former Yugoslav Republic of Macedonia,let bag bodi begin lol paint cut bad,0,104,19,4.526315789473684,0,Unknown
7074,meltdown,Storybrooke / The Moors,school commerc come sister meltdown,0,76,14,4.5,0,Unknown
7604,pandemonium,"Everett, WA",love diablo map theme place like westmarch mt arrest pandemonium,0,108,18,5.055555555555555,0,Botswana
10302,weapon,"UK,singer,songwriter,?2 act",hey guy thank rock world follow,0,81,14,4.857142857142857,0,Ukraine
3025,death,,katherin death,0,71,5,13.0,0,Unknown
4754,evacuate,"St. Catharines, Ontario",life,0,24,4,5.25,0,Unknown
5826,hail,United States,un continu sever thunderstorm warn wind 60 mph hail ltd weston custer fall river pennington sd till 715 p,1,142,23,5.217391304347826,0,United States Minor Outlying Islands
2656,crush,Houma La,woman crush wednesday,0,53,5,9.8,0,Unknown
10552,windstorm,,insur tea seek comment rule chang windsor insur tea depart insur,1,137,18,6.611111111111111,1,Unknown
6305,hostage,,u mug ur u come good excus look like bitch want fight hold u hostag,0,136,31,3.4193548387096775,0,Unknown
2288,cliff fall,36 & 38,hope u trip n fall cliff tweet,0,72,13,4.615384615384615,0,Unknown
5186,fatalities,,katana fatal slay bodi vine,1,98,13,6.384615384615385,0,Unknown
3718,destroyed,USA,black eye 9 space battl occur star a74 involv 2 fleet total 3967 ship 39 destroy,0,106,19,4.631578947368421,0,United States
3003,death,,onli text 2 night boyfriend love boy death night hold attend like,0,140,30,3.7,0,Unknown
9096,suicide bomb,"London/Lagos/FL ÌÏT: 6.6200132,",pic ayr old pkk suicid bomber devon bomb turkey armi trench rella,1,130,17,6.705882352941177,0,Aruba
6918,mass murderer,"Tennessee, USA",hey movietheatr mass murder wanna play shit 615,1,77,13,5.0,2,United States
5176,fatalities,TechFish ,5 reject mortal combat fatal mortal combat stretch boundari,0,135,15,8.066666666666666,0,Unknown
3933,devastated,,agnew ibama declar disea typhoondevast sapan ibama sign disea declar northern,1,136,15,8.133333333333333,0,Unknown
17,nan,,aha south tampa flood hah wait second live south tampa fuck flood,1,129,27,3.814814814814815,1,Unknown
893,bioterrorism,,satan daughter shadow warrior leave woman aka transcend mode ps nec fold extra extra center bioterror,1,137,22,5.2727272727272725,0,Unknown
4122,drought,"Orlando, FL",weed news marijuana california drought wor christian scienc monitor,1,110,14,6.928571428571429,1,Falkland Islands (Malvinas)
105,accident,Australia,bigrigradio live acid away,1,35,4,8.0,0,Australia
4168,drown,"Morris, IL",ev wanna drown s idiot,0,49,10,4.0,0,Israel
9739,tragedy,,fli tragedi mp live recount horror coach train fling water,1,137,23,5.0,0,Unknown
5913,harm,Hogsmeade,anyon harm boy impe secur fan real quick,0,112,22,4.136363636363637,0,Unknown
2768,curfew,,thank citi wide curfew,0,65,13,4.076923076923077,0,Unknown
9866,traumatised,cork,watch tat like horror flashback everi traumat,0,128,20,5.45,1,Unknown
8735,sinking,,horribl sink feel yous home phone realis g time,1,129,25,4.2,0,Unknown
2733,crushed,Sunny South florida ,wrap tv compani share crush disney disappoint,0,96,11,7.818181818181818,0,Unknown
8003,razed,Nairobi-KENYA,georg jenna hero save burn friend race wildfir,1,96,13,6.461538461538462,0,Unknown
3907,devastated,,ibama declar disea typhoondevast sapan world,1,87,8,10.0,1,Unknown
5157,fatal,,11yearold boy charg manslaught toddler report 11yearold boy charg manslaught fatal sh,1,136,20,5.85,0,Unknown
636,arsonist,,like video town salem win arsonist,0,107,18,5.0,0,Unknown
397,apocalypse,sindria,ohh fukurodani dint surviv apocalyps bout feel horribl poor boy poor child,1,96,16,5.0,0,Unknown
9985,tsunami,The Netherlands,fukushimatepco mountain debri japanes tsunami float west coast,1,121,15,7.0,2,Unknown
6474,injured,,alsowhat st team player injuredthen milic slate play theme win,1,138,21,5.619047619047619,0,Unknown
2991,dead,United States,typhoon soudelor dead aim taiwan,1,65,8,7.25,0,United States Minor Outlying Islands
1385,body bag,New York,loud vuitton monogram sophi limit edit clutch cross bodi bag read bay,0,133,17,6.882352941176471,0,Unknown
5292,fear,,tell bride fear,0,38,8,3.875,0,Unknown
6980,massacre,,murder 513 palestinian child 70 12 sure gaza massacr zionist moralityzion world evil,1,139,21,5.666666666666667,0,Unknown
9988,tsunami,"East Islip, NY",world war truli end rippl compound low level tsunami,1,119,22,4.454545454545454,0,Unknown
5526,flattened,"new york, ny",yosemit sam drum nobodi ill vote flatten rabbit skin huh huh alway,0,122,22,4.590909090909091,0,Germany
8959,storm,"West Palm Beach, Florida",look like perfect tormor come check outdoor happen featur eventspalmbeach,1,137,17,7.0588235294117645,1,Unknown
520,army,Pakistan,drayesha4 indiakomuntorjawabdo indian armi ki,0,142,28,4.0,1,Pakistan
3945,devastated,Varies ,stuart broad prime mini good thing sport year aussi look devant bless,0,129,23,4.6521739130434785,0,Unknown
7568,outbreak,"Stockholm, Sweden",let tri good prevent noth outbreak violenc talk peopl polit,1,136,24,4.708333333333333,0,Sweden
160,aftershock,,growingupspoil clay pigeon shoot cri becaus aftershock,0,83,11,6.636363636363637,1,Unknown
9846,trauma,The Triskelion,partial cometh trauma long stori honest like talk,0,124,25,4.0,0,Unknown
6195,hijacker,,hijackerturnedsattutor eva author dead,1,104,11,8.545454545454545,0,Unknown
10413,whirlwind,"Orlando, FL",mantra morn head whirlwind trip south,0,100,14,6.214285714285714,1,Falkland Islands (Malvinas)
3174,deluge,eARth 3,fifth predynast king legendari period befor delug dumuzid shepherd,0,121,15,7.133333333333334,3,Unknown
3798,detonate,"Morioh, Japan",noth stand devon killer queen,0,99,18,4.555555555555555,0,Japan
7291,nuclear disaster,,nuclear polic japan respond nuclear disea repeat failur antonym guardian time reuter,1,140,17,7.235294117647059,8,Unknown
7677,panic,518 åá NY,contact fall convinc dint gang eyebal panic attack caus damag,0,147,28,4.285714285714286,0,Unknown
6020,hazardous,,hazard world aliv,1,83,11,6.636363636363637,0,Unknown
9090,structural failure,,invest fatal virgin palac spaceship crash year structur failur co pilot unlock brake,1,138,21,5.619047619047619,0,Unknown
320,annihilated,,70 year sinc nihil 100000 peopl instant becam away bail nihil human,1,131,22,5.0,0,Unknown
8088,rescue,,mani dog rescu dog,0,71,13,4.538461538461538,0,Unknown
6230,hijacker,,media airplan hijack hard shell cast star deviant dyxtmrydu,1,76,10,6.7,0,Unknown
926,bioterrorism,Searching for Bae ,threat anthrax cdc,1,61,9,5.888888888888889,0,Unknown
4624,emergency services,USA,break news tasmania emerg servic train hor,1,131,17,6.764705882352941,2,United States
6951,massacre,"Ashburn, VA",buy ticket death bed dude bro pay massacr iii w live,0,123,19,5.526315789473684,0,Latvia
9894,traumatised,Stage with Trey Songz,spider legit run chest traumat life,0,68,12,4.75,0,Unknown
1591,bombed,"DaKounty, Pa",bomb kane elephantintheroom,1,66,8,7.375,1,Pakistan
6132,hellfire,,prophet peac save hellfir half date chariti,1,114,22,4.2272727272727275,0,Unknown
1379,body bag,New York,new ladi shoulder tote handbag woman cross bodi bag faux leather fashion pur,0,139,18,6.777777777777778,0,Unknown
3322,demolished,???????????,final demolish spring 2013 properti sit vacant sinc middlebrook,0,138,20,5.95,0,Unknown
6515,injuries,Bay Area,sur gym tomorrow bodi int 50 wanna risk injuri,0,84,15,4.666666666666667,0,Unknown
3014,death,,papiichampoo enjoy ibama era civil prey support iranian death,0,136,21,5.523809523809524,1,Unknown
7860,quarantined,"Sarasota, FL",credit new content polic effect mani horribl subreddit ban quarantin,1,137,15,8.2,0,Falkland Islands (Malvinas)
2114,catastrophe,,failur misfortunebut regret catastroph,0,50,8,5.375,0,Unknown
9472,terrorism,Riyadh,islam save person equal reward save human islam opposit terror,1,102,19,4.421052631578948,1,Unknown
2849,cyclone,,wfp wfp delia food 165000 bangladesh flood victim tropic cyclon woman dhaka unit na,1,137,19,6.2631578947368425,0,Unknown
1254,blood,,kinda ship nasti blood pun intend,0,53,11,3.909090909090909,0,Unknown
1607,bombed,MY RTs ARE NOT ENDORSEMENTS,yeah man bomb hard,0,77,9,7.666666666666667,0,Unknown
6145,hijack,,day bug patch os x come activ exploit bypass password ar technic,0,119,19,5.315789473684211,0,Unknown
4413,electrocute,,sea electrocut,0,34,7,4.0,0,Unknown
8754,siren,New York,helen model 295ss100 siren amplifi polic emerg vehicl read bay,0,129,15,7.666666666666667,0,Unknown
3055,deaths,"Mooresville, NC",ic7 south huge wreck airlift death interest complet block,1,103,17,5.117647058823529,0,New Caledonia
6301,hostage,Indiana,tomislav slope islam state recent hostag,0,89,12,6.5,0,Unknown
5608,flood,"Knoxville, TN",flood advisori issu august 05 710pm cdt august 05 800pm cdt news urban weather,1,136,22,5.2272727272727275,1,Bhutan
840,bioterror,"Phoenix, AZ",feel stop transport bioterror germ lab mishap feel stop transport certain research,1,136,17,7.0588235294117645,0,Azerbaijan
65,ablaze,,gain 3 follow week know stat grow,0,96,16,5.0625,0,Unknown
7987,razed,,late home raze northern california wildfir abc news,1,94,13,6.3076923076923075,0,Unknown
5024,eyewitness,United States,read eyelid account hiroshima day 1945 life,1,116,14,7.357142857142857,2,United States Minor Outlying Islands
2102,casualty,Seattle,non play dust hairstyl trap mess mix event record alien casualti,1,138,15,8.266666666666667,1,Unknown
684,attack,,nashvill theater attack gun grabber demand hatchet control,1,101,11,8.181818181818182,0,Unknown
6198,hijacker,,school bus hijack parol 39 year,1,70,9,6.888888888888889,0,Unknown
3190,deluge,"Atlanta, Ga",onli showman save big east delug supernatur monstrous read free,0,140,17,7.294117647058823,0,Gabon
6255,hijacking,EastCarolina,hot antenna hijack comput send datum sound wave black hat 2015 firebreak good,0,119,16,6.4375,3,Unknown
2582,crash,"Kenton, Ohio",ill crash,1,45,5,8.2,0,Unknown
5103,famine,,robert conquest famin museum kiev,0,83,8,9.5,0,Unknown
3695,destroy,Pretoria,catch minut final monwabisi shoot lol longman rat twin r destroy ashestoash,0,135,23,4.913043478260869,1,Unknown
4700,epicentre,"Charlotte, NC",tomorrow kick weekend drink entertain,0,121,12,9.166666666666666,0,New Caledonia
8973,storm,#BossNation!,fiona storm fuck outta start hurt like mf,0,63,12,4.333333333333333,0,Unknown
4895,explode,,mess explod,1,49,8,5.25,0,Unknown
10071,typhoon,,agnew ibama declar disea typhoondevast sapan ibama sign disea declar northern,1,136,15,8.133333333333333,0,Unknown
4924,exploded,Australia,junk 13 year old atom bomb explod hiroshima august 6 1945,1,132,18,6.388888888888889,1,Australia
5187,fatalities,"Youngstown, OH",osf concern mount fatal,1,85,7,11.285714285714286,0,Unknown
10662,wounds,The American Wasteland (MV),vault look wind like place carri,0,139,28,4.0,0,Unknown
4079,displaced,"Oakland, CA",histori flood asia leav hund dead million display,1,116,11,9.636363636363637,0,Central African Republic
3369,demolition,,download watch deposit frog 2002,1,75,8,8.5,3,Unknown
10810,wrecked,6,lol u wreck,0,29,5,5.0,0,Unknown
4854,evacuation,,reid lake fire prompt campground order,1,73,8,8.25,0,Unknown
7334,nuclear reactor,"Washington, D.C.",salem 2 nuclear reactor shut elect circuit failur pump,1,96,13,6.461538461538462,0,Unknown
1356,blown up,kisumu,loner diari pattern sand blow away photo choke flame,0,142,22,5.181818181818182,0,Unknown
7965,razed,,late home raze northern california wildfir,1,108,12,8.083333333333334,0,Unknown
3085,deaths,,stat high auto death appli child vehicl guess run lightrail adult,0,144,25,4.8,0,Unknown
5783,forest fires,,ur friend u talk forest fire forest tell u drop ur mix tape straighter,1,125,25,4.04,1,Unknown
2843,cyclone,Melbourne,ask cyclonesama read jail fate window,0,78,13,5.076923076923077,0,Unknown
158,aftershock,Instagram - @heyimginog ,speak someon use scum b1 peopl end ps,0,125,24,4.25,0,Unknown
1735,buildings burning,"Denver, Colorado",rock fire burn northern california threaten 7000 build larg state 9newsmorn,1,137,21,5.571428571428571,1,Unknown
2579,crash,"  Melbourne, Australia",kick crash bad expert play video game,0,131,20,5.6,0,Australia
5836,hailstorm,USA,rainstorm hey secret trick 375000 gem clash ocean check profit,0,114,20,4.75,0,United States
10458,wild fires,nap central,wild fire freak fuck like hell,1,46,10,3.7,0,Unknown
3476,derailed,"Washington, DC",metro doe know blue orang line reopen empti pass car derail 5 new 7000seri mata,1,142,24,4.958333333333333,2,Unknown
997,blazing,Your screen,s3xleak photo yrs old ash ladi festa town delta expos ibm 5 leak pictur,0,128,19,5.7368421052631575,0,Unknown
8888,smoke,Indonesia,mean mino doe smoke u mention befor,0,93,17,4.529411764705882,0,Indonesia
1190,blizzard,Sydney,hi assay believ god coutur present noth like live,1,134,24,4.625,0,Unknown
7619,pandemonium,,world class girl ass 02 scene 4 pandemonium,0,71,11,5.545454545454546,0,Unknown
9474,terrorism,"toronto, ontario",arrest report affirm terror,1,53,6,8.0,0,Unknown
3537,derailment,"Chicago, IL",photo green line derail near cottag grove garfield,1,108,11,8.909090909090908,0,Israel
5172,fatalities,"Chamblee, Georgia",month mark total 662 fatal 114 half year,1,129,24,4.416666666666667,0,Georgia
4357,earthquake,Desde Republica Argentina,simo ml 24 near coast western turkey magnitud 24regionnear coast western turkey cs,1,140,18,6.777777777777778,2,Unknown
10197,violent storm,Oshawa/Toronto,violent belling storm enjoy watch unfold,1,74,12,5.25,0,Unknown
1719,bridge collapse,,marshal plan unit state zambia mayo open,0,105,16,5.625,1,Unknown
8755,siren,The Web,good time day liveonstream,0,86,11,6.909090909090909,1,Unknown
9547,threat,,end australia good burger,0,85,11,6.818181818181818,0,Unknown
6579,injury,,enter world extrem dive 9 stori volga river,0,98,16,5.1875,0,Unknown
9529,terrorist,,ira soldier wind west bank terrorist attack rworldnew,1,100,12,7.416666666666667,0,Unknown
6653,landslide,,sink hole earth slide avalanchesgtgt allah islam sinkhol landslid avalanch usa franc uk msc,1,146,16,8.125,10,Unknown
418,apocalypse,Albuquerque,begin day snow apocalyps,1,49,10,4.0,0,Unknown
10863,nan,,world fall powerlan link tram updat fire crew 30 pass tr,1,136,19,6.2105263157894735,1,Unknown
5727,forest fire,,grill school function grill pretti forest fire work,0,138,28,3.9642857142857144,0,Unknown
14,nan,,emerg happen build street,1,79,12,5.666666666666667,0,Unknown
9911,trouble,,troubl understand rotat leave lean red black tree class current learn,0,136,17,7.0588235294117645,0,Unknown
6766,lightning,,blink light w,1,75,12,5.333333333333333,0,Unknown
4296,drowning,"Pennsylvania, USA",feel like drown insid bodi,0,45,9,4.111111111111111,0,United States
7515,oil spill,Clean World,watch video mendel berri speak bp oil spill gulf mexico birthday,1,136,21,5.380952380952381,0,Unknown
1382,body bag,"sitting on Eddie Vedders lap,",ditto way feel drink vodka ice bodi bag,0,114,25,3.6,0,Aruba
4810,evacuated,"Gold Coast, Australia",tram travel powerlan come surfer,1,86,10,7.7,0,Australia
1002,blazing,worldwide,whi traffic free cold blaze hot heat traffic,0,121,21,4.809523809523809,0,Unknown
9387,survived,,peopl plot wonder surviv,0,79,14,4.714285714285714,0,Unknown
4989,explosion,,cum explor,0,149,11,11.363636363636363,1,Unknown
5949,hazard,,road hazard cascad rd sw childless dr sw,0,68,11,5.2727272727272725,0,Unknown
9830,trauma,www.aprylpooley.com,a1 start write talk trauma therapi onli way communi gravitychat,0,122,22,4.590909090909091,1,Unknown
6745,lava,"di langit 7 bidadari (^,^ )",lava blast dan power red pantherattack,1,75,9,7.444444444444445,1,Unknown
7253,nuclear disaster,,natur diseas increa japanjapan nuclear safeti standard far inferior standardanonym time,1,135,17,7.0,7,Unknown
