id,keyword,location,text,target,num_char,num_words,avg_word_length,num_hashtags,country
4516,emergency,"Based out of Portland, Oregon",intern emerg medicin confer w lennox hill hospit drjustinmazur,0,108,13,7.384615384615385,2,Unknown
8432,sandstorm,USA,watch airport swallow sandstorm minut,1,91,14,5.571428571428571,0,United States
8608,seismic,Somalia,explor seismic shift gabon somalia worldoil subscript somalia,0,118,14,7.5,2,Somalia
1775,buildings on fire,"Manchester, NH",fire destroy build street manchest,1,79,10,7.0,1,Unknown
7295,nuclear reactor,,err509,0,7,1,7.0,0,Unknown
4246,drowned,All around the world!,coalit fond 1984style totalitarian surpris copi,0,136,16,7.5625,0,Unknown
1821,burned,toronto Û¢ dallas,hate tri straighten hair brother come swoop scare burn finger,0,124,25,4.0,0,Unknown
6277,hijacking,Malaysia,murder stori america hijack,1,73,8,8.25,0,Malaysia
3635,desolation,Middle Earth / Asgard / Berk,autoset elanorofrohan decemb 2013 green carpet zurich swiss premier esol,1,132,17,6.823529411764706,0,Unknown
6810,loud bang,,loud bang outsid earli check find dad floor chair sit broke,0,140,26,4.423076923076923,0,Unknown
10573,windstorm,LYNBROOK,insur tea seek comment rule chang windsor insur,0,96,12,7.083333333333333,1,Unknown
2446,collide,,devil collid wattys2015 watteau teenfict,0,108,11,8.909090909090908,3,Unknown
7507,oil spill,,refugia oil spill costlier big project,1,85,11,6.818181818181818,0,Unknown
8933,snowstorm,Mountains,new photo oak snowstorm southdown hampshir winter photograph art tree treescap freeborn,0,135,17,7.0,9,Unknown
6387,hurricane, Miami Beach,everyon wonder win wonder grape real b17,0,93,16,4.875,1,Unknown
9651,thunderstorm,,strong thunderstorm affect central halifax counti 1145 pm edt halifax va till 1145 pm edt,1,134,20,5.75,0,Unknown
4010,disaster,,wo nana franc remind america right befor war iraq restless lead disea,1,139,24,4.833333333333333,0,Unknown
7696,panicking,"Petaluma, CA",save panic hello,0,60,11,4.545454545454546,0,Central African Republic
528,army,New York,wwf wwii japanes armi navi militari japan leather watch war mid wwf 2 read bay,0,137,20,5.9,0,Unknown
9449,terrorism,,truth news bbc cnn islam truth god isi terror duran lie,1,131,13,8.307692307692308,10,Unknown
9322,survive,Barbados,realiz honest surviv glass lol,0,67,11,5.181818181818182,0,Barbados
8715,sinking,,titan jack rise stay wooden beam sink,0,98,18,4.5,0,Unknown
929,blaze,California,crave u,0,23,3,7.0,0,Unknown
2245,chemical emergency,"Jersey City, NJ",fortun rework plumb emerg chemic shower draw glitter pipe occam,0,135,22,5.181818181818182,0,Unknown
8505,screaming,Massachusetts ,time swim basic scream whi doe smelltast bad,0,109,19,4.7894736842105265,0,Unknown
20,nan,,damag school bus 80 multi car crash break,1,56,11,4.090909090909091,1,Unknown
6429,hurricane,,prob,1,24,3,7.333333333333333,0,Unknown
7588,outbreak,kano,famili sue legionnair 40 famili affect fatal outbreak legionnair dista,1,136,18,6.611111111111111,0,Unknown
4791,evacuated,"Chicago, but Philly is home",78 pass safe green line train detail,1,85,10,7.6,0,Unknown
1513,body bags,Bushkill pa,handel member congress want deal kid b come home bodi bag war money,0,138,26,4.346153846153846,1,Unknown
6003,hazardous,United States,jul issu hazard weather outlook,1,70,8,7.75,1,United States Minor Outlying Islands
3181,deluge,,bill sometim truck unload rescript delug index explain whi,0,140,22,5.409090909090909,1,Unknown
6912,mass murderer,,fine line btw mass murder terrorist yes know polit social aspect howe,0,136,25,4.48,0,Unknown
3500,derailed,"Arlington, VA and DC",today metro commit debacl derail nonpasseng train clear need rail mgr ceo,1,137,18,6.666666666666667,1,Unknown
8443,screamed,,slam phone ground scream ahahahga,0,59,11,4.454545454545454,0,Unknown
4757,evacuate,FSC '19,want everyon know emil worri milkshak suppos,1,112,21,4.380952380952381,0,Unknown
1196,blizzard,,lucio let overwatch hype train roll caution agent break,0,117,17,5.9411764705882355,1,Unknown
2546,collision,"Denver, Colorado",motorcyclist bicycl injuri denver colli broadway,1,85,9,8.555555555555555,0,Unknown
2414,collide,,ffr300 star war star trek collid pluto moon charon pluto,0,117,14,7.428571428571429,1,Unknown
3383,demolition,,think demo car friend join deposit derbi kenosha,0,91,16,4.75,0,Unknown
8480,screamed,pissing off antis,scream chanc,0,50,6,7.5,0,Unknown
1787,buildings on fire,taken by piper curda,someon mention dansey fire bust brick wall seven differ build,1,98,15,5.533333333333333,0,Unknown
1420,body bag,Paignton,new ladi shoulder tote handbag faux leather hobo pure cross bodi bag woman,0,129,16,7.125,2,Unknown
1603,bombed,The land of New Jersey. ,shadowflam wraith bomb,1,69,8,7.75,0,Unknown
10563,windstorm,"calgary,ab",precious oliv tree lose battleanoth crazi windsor myc,1,113,13,7.769230769230769,1,United Arab Emirates
3691,destroy,,save rich heaven decre becaus thief moth destroy,0,121,23,4.304347826086956,0,Unknown
8541,screaming,amsterdayum 120615 062415,omgggg scream,0,47,5,8.6,0,Unknown
4058,displaced,"Ojodu,Lagos",angri woman open accus enema steal relief materia mean dip angri intern display wom,0,136,18,6.611111111111111,0,Unknown
8642,sinkhole,Unknown ,sinkhol seri believ brooklyn sinkhol sinkhol seri bell,0,137,16,7.0,0,Unknown
9598,thunder,Baydestrian,sudden gloom thunder loud shake window bay area miss lol,1,146,25,4.88,0,Unknown
7479,obliteration,Federal Capital Territory,alhaji pugin far good person sha row seat complet obit beto cement competitor,0,138,26,4.346153846153846,0,Unknown
5338,fire,  å_ ,wow tha bitch fire,0,35,6,5.0,0,Unknown
10303,weapon,"kediri,,jawa timur",m believ blue isi kwwwkwwwk weapon blue hug jiahahahha yeyeulala,0,111,16,5.75,0,Aruba
9388,survived,"Austin, TX",surviv spanish sweet ritual,0,57,6,8.666666666666666,0,Unknown
235,airplane accident,India,omg horribl acid man die wing airplan,1,75,10,6.6,0,India
9173,suicide bomber,,suicid bomber kill 15 saudi secur site mosqu reuter,1,109,13,7.461538461538462,0,Unknown
6092,hellfire,jeddah | Khartoum,bear temper loo tongu danger weapon combin lead person hellfir islam,0,120,21,4.761904761904762,1,Unknown
6490,injuries,North London,possibl s injuri ankl 2011 wor regardless,0,111,16,6.0,0,Unknown
8948,storm,,new bay uk star war storm trooper pop vinyl bobbi head figur pop fungi,0,124,17,6.352941176470588,0,Unknown
3042,death,"Los Angeles,CA, USA",video slain mexican journalist unknown predict death,0,109,12,8.166666666666666,0,Central African Republic
5588,flood,New York,pcs cree lead work light road lamp car truck boat owd flood beam rea,0,139,20,5.95,0,Unknown
2164,catastrophic,,catastroph effect hiroshima nagasaki atom bomb feel today,1,112,14,7.071428571428571,0,Unknown
8468,screamed,"Trumann, Arkansas",26 peopl scream right ear week camp 12 day leav cedarglade2015,0,118,21,4.666666666666667,1,Unknown
10518,wildfire,"California, USA",california battl scari 2015 wildfir far rock fire,1,96,14,5.928571428571429,0,United States
6837,loud bang,Kenya,daviesmutia break news confirm hear loud bang nearbi appear blast wind neighbour ass,1,136,24,4.708333333333333,0,Kenya
9770,trapped,,hollywood trap miner rella chile,0,77,9,7.666666666666667,0,Unknown
623,arsonist,"Adelaide, South Australia",arsonist blame blaze plastic recycl busi adelaid report 7newsadl,0,136,18,6.611111111111111,1,Unknown
1666,bombing,,oh fuck bill clinton bomb fuck nato,0,54,11,4.0,0,Unknown
8859,smoke,Soufside,night sell weed smoke stay high nigra way,0,84,16,4.25,0,Unknown
1507,body bags,,woman tote faux leather handbag shoulder cross bodi hand bag rise,0,120,14,7.642857142857143,0,Unknown
10249,volcano,,la startup hot flower come straight volcano,0,113,17,5.705882352941177,0,Unknown
4509,emergency,USA,deal 37592 temporari fake tooth tooth replac kit emerg dental oral care come,0,139,16,7.75,1,United States
8024,refugees,,read 12000 nigerian refug repair cameroon,1,62,8,6.875,0,Unknown
5378,fire truck,,garbag truck realli catch fire mao,0,46,8,4.875,0,Unknown
4454,electrocuted,,electrocut morn day,0,57,11,4.2727272727272725,0,Unknown
331,annihilated,"West Lancashire, UK.",juda priest 2005 rob come scorpion support fuck nihil place astonish gig,0,140,21,5.714285714285714,0,Unknown
10809,wrecked,,twin pitcher ego wreck,0,38,7,4.571428571428571,0,Unknown
4883,explode,"Oklahoma City, OK",brain d explod mao,0,33,7,3.857142857142857,0,Cook Islands
10244,volcano,Indonesia,zeal volcano peak grass insect doe grow,1,77,15,4.2,0,Indonesia
2122,catastrophe,"New Brunswick, NJ",god bless catastroph,0,21,3,6.333333333333333,0,Unknown
3188,deluge,,wrinkl face delug decay,0,39,7,4.714285714285714,0,Unknown
7783,police,,polic walk blow smoke dey face wanna lock dope shit gay,0,95,23,3.130434782608696,0,Unknown
10765,wreckage,iTunes,scienc piec wreckag flight mh370 confirm union island possibl t,1,137,21,5.523809523809524,1,Unknown
5254,fatality,"Bishops Stortford, England",yes appear report cow fatal sad,1,80,11,6.363636363636363,0,Unknown
5188,fatalities,,mortal combat x fatal meat predat,0,74,9,7.222222222222222,0,Unknown
8841,sirens,,run siren half hour hotel premium promot offer,0,120,14,7.642857142857143,0,Unknown
39,nan,,love girlfriend,0,18,3,5.333333333333333,0,Unknown
7903,radiation emergency,"La Grange Park, IL",doe wipe fail nm invest site filter radial read activ emerg op center offsid rella,0,137,21,5.571428571428571,0,Israel
8858,smoke,,date someon doe let smoke leav date someon smoke trust,0,108,20,4.45,0,Unknown
1309,bloody,Shity land of Northern Ireland,think blood bark,0,55,10,4.6,0,Unknown
868,bioterror,Across the Atlantic,breakingnew feel long transport research specimen potent bitter,0,138,14,8.928571428571429,1,Unknown
7957,rainstorm,ECSU16,way like rainstorm hous card,0,70,16,3.4375,0,Unknown
2459,collided,"Peterborough, On",newswatch 2 vehicl collid lock lansdown st pto emerg crew way,1,92,16,4.8125,2,Unknown
6078,heat wave,,long streak tripledigit heat sinc 2013 forecast dalla,1,111,12,8.333333333333334,0,Unknown
8524,screaming,Honeymoon Ì£ve.,love scream,0,73,11,5.7272727272727275,0,Unknown
2400,collapsed,,petit heartless owner whip hor collar tell aim act,1,128,20,5.45,0,Unknown
3367,demolition,Chicago,save citi old town propo deposit 159 west burton,1,123,17,6.294117647058823,0,Unknown
8706,sinking,,horribl sink feel yous home phone realis g time,0,130,25,4.24,0,Unknown
9905,traumatised,,traumat,0,69,5,13.0,0,Unknown
5019,eyewitness,canada,dutch crane collaps demolish hous drama eyelid video captur moment dutch crane hoist,1,135,16,7.5,0,Unknown
5344,fire,Makai,activ yukio fire card,0,49,6,7.333333333333333,0,Unknown
9859,traumatised,Ireland,ireland v sadtraumati free beauti parisian summer becom accustom,0,116,18,5.5,0,Ireland
5412,first responders,"Nashville, Tennessee",grate respond act swift save countless live today,1,132,21,5.333333333333333,0,Unknown
8567,screams,W.I.T.S Academy,scream,0,23,2,11.0,0,Unknown
262,ambulance,Amsterdam,twelv fear kill pakistani air abul helicopt crash,1,110,11,9.090909090909092,0,Unknown
9239,suicide bombing,,remem marley menachem 22 masha satsuma murder hama terrorist suicid bomb eg bus 361,1,123,20,5.15,0,Unknown
1971,bush fires,Head Office: United Kingdom,insan bush fire california safe,1,65,8,7.25,0,Unknown
6056,heat wave,,heat wave squad revitup pisarev,1,66,8,7.375,3,Unknown
2588,crash,"Charleston, SC",fatal crash report john island,1,61,7,7.857142857142857,0,Seychelles
9231,suicide bombing,EARTH,russia fire 2015 look happen 911bomb marin barrack suicid bomber attack world site,1,137,21,5.523809523809524,0,Unknown
3789,destruction,,marqu como vista dragon ball super x1 god district dream bancodeseri,0,114,16,6.1875,1,Unknown
1532,bomb,"Lincoln, NE",sheaf comment new evil japan effort build atom bomb end wwii,1,114,19,5.052631578947368,0,Montenegro
3810,detonate,"KÌ¦ln, Nordrhein-Westfalen",devon feat mop apollo brown,1,62,7,8.0,0,Unknown
6617,inundated,,anund atm want grand job pro,0,127,22,4.7727272727272725,1,Unknown
1155,blight,Me mammy's belly,sure purdi aliv blight,0,59,11,4.454545454545454,0,Unknown
6402,hurricane,"Anderson, SC",hurrican sick,1,17,2,8.0,0,Seychelles
523,army,,direct pick fan armi direct x86,0,103,12,7.666666666666667,1,Unknown
7106,military,,peopl die human expert unit 731 japane militari,1,140,17,7.294117647058823,0,Unknown
5286,fear,,shake fear s hack planet,0,66,12,4.583333333333333,0,Unknown
10636,wounds,Charlotte ,gunshot wound 9 bicep onli wound chesttorso area kerricktri jonathanferrel,1,133,23,4.782608695652174,3,Unknown
1691,bridge collapse,Pittsburgh PA,becaus need know suppos throw bring collar plan parad,0,136,26,4.269230769230769,1,Unknown
48,ablaze,Birmingham,wholesal market ablaz,1,55,5,10.2,0,Unknown
4672,engulfed,,come land engulf tribal war turn land peac ie marina prophetmuhammad islam,0,123,23,4.391304347826087,2,Unknown
7638,pandemonium,,pandemonium aba woman delia babi face,0,103,12,7.583333333333333,0,Unknown
6374,hostages,,nigerian militari rescu 178 hostag book harm florida sentinel bulletin florid secur terror,1,136,16,7.5625,2,Unknown
4562,emergency plan,"Calgary, Alberta, Canada",activ emerg plan amid sever thunderstorm warn myc storm,1,133,12,10.166666666666666,2,Canada
10027,twister,,reason brain twister oneself discount redesign webster itrawcwb,0,81,10,7.2,0,Unknown
7758,police,,vinni beat northumbria polic,0,76,10,6.7,0,Unknown
7166,mudslide,"Chiswick, London",2 great new recip mudslid cake sorri stew ebbo,0,59,11,4.454545454545454,1,Unknown
3047,death,"New York, New York",trial death cecilthelion postpon,0,110,13,7.538461538461538,1,Unknown
2841,cyclone,,1970 mercuri cyclon gt quarter panel ds rear trim mould cobra jet 429cj,1,122,15,7.2,0,Unknown
6550,injury,,poster ergo potato cuff injuri recoveri kit super high convert potato cuff inj,0,133,15,7.933333333333334,3,Unknown
8744,siren,kenya,aha jam imeshika papa garden citi mat bumper bumper far abul decid chill pig siren ian,0,140,22,5.409090909090909,0,Unknown
128,accident,"New Hanover County, NC",fbi caddi acid proper damagenhs999 pine rdhorndal dr,1,67,8,7.5,0,New Caledonia
5439,first responders,Aberdeenshire,want futur respond high tech,0,78,11,6.181818181818182,0,Unknown
10236,volcano,Santiago de Cmpostela Galicia,ad video playlist doc volcano earthquak insid volcano,1,113,17,5.705882352941177,0,Unknown
680,attack,"Halton, Ontario",suspect late theatr attack psycholog issu,1,106,11,8.727272727272727,0,Unknown
10743,wreckage,WorldWide,australia news janeenorman high probabl aircraft wreckag mh370 accord deputi prime,1,139,18,6.777777777777778,3,Unknown
9047,structural failure,,virgin palac crash earli unlock brake trigger structur failur,1,100,11,8.181818181818182,0,Unknown
864,bioterror,"Atlanta, GA",feel long transport bioterror germ,0,83,10,7.4,0,Gabon
3524,derailment,,madhya pradesh train derail villag youth save mani live group villag save 70 pass live train,1,136,21,5.523809523809524,0,Unknown
849,bioterror,,feel long transport bioterror germ wake anthrax lab mishap news phone appli mobil,1,126,18,6.055555555555555,4,Unknown
6362,hostages,"Cleveland, OH",barak tell american peopl live hostag iran depend congress vote terrorist nuke hostag,1,140,25,4.64,0,Unknown
5222,fatality,Boston Û¢ Cape Cod ?,die lyme dista case fatal rate near 100,1,76,10,6.7,0,Unknown
3913,devastated,-?s?s?j??s-,ibama declar disea typhoondevast sapan ibama sign disea declar northern marian,1,136,15,8.133333333333333,0,Unknown
10125,upheaval,IG/SC:bjfordiani,oh rich soil wonder uphold,0,85,11,5.909090909090909,0,Unknown
1195,blizzard,Himalayan Mountains,tweet4taiji dolphin worship group base superstar look sweet,1,97,16,5.125,1,Unknown
10082,typhoon,"Santiago,RepÌ¼blica Dominicana",ibama declar disea typhoondevast sapan ibama sign disea declar northern marian,1,136,15,8.133333333333333,0,Unknown
2043,casualties,USA,noth day pass thank central command confirm new casualti plea pray,1,137,19,6.2631578947368425,0,United States
2832,cyclone,Beside Basketball,talent misdirect cyclon pass ignit pass vanish drive phantom shot kurokobot,1,86,11,6.818181818181818,1,Unknown
3758,destruction,,fall break homeboy miscalcul district thousand mwjcdk,0,92,12,6.75,0,Unknown
4458,electrocuted,HTX,fr cut risk electrocut everi shower,0,72,10,6.3,0,Unknown
5235,fatality,434,usual happen,0,26,4,5.75,0,Unknown
7175,mudslide,,yous 100 fuck paul cake look like mudslid like rubber,0,95,17,4.647058823529412,0,Unknown
5938,hazard,,yeah think s lit think hazard player,0,108,20,4.45,0,Unknown
5966,hazard,Dil's Campsite,becaus fire safeti hazard,1,71,12,5.0,0,Unknown
2780,curfew,,turn blind eye bloke drink smoke sure curfew time cost worth hassl,1,129,25,4.2,0,Unknown
10659,wounds,,11 punctur wound,0,18,3,5.333333333333333,0,Unknown
852,bioterror,"Oxford, MS",math problem research feel long transport select agent,1,129,17,6.647058823529412,0,Montserrat
4149,drown,,drown water enter lung aliv great countri fall shit becaus pussi,0,140,26,4.423076923076923,0,Unknown
10151,upheaval,"London, UK",diagnos ceo stress board revolt unit spirit impact indian,0,117,16,6.375,0,Ukraine
2807,cyclone,"Des Moines, Iowa ",big annual footbal medium day befor cyclon hoop recruit nugget,1,122,21,4.857142857142857,0,Unknown
7309,nuclear reactor,"Eaubonne, 95, France",navi sidelin 3 new sub,0,54,7,6.857142857142857,0,France
2077,casualty,"Fairfield, California",trauma center shine respond multicasualti crash,1,119,11,9.909090909090908,0,Unknown
3975,devastation,Devon/London ,devant smash phone,0,68,8,7.625,0,Unknown
8558,screams,Freddy Fazbears pizzeria,screamsdont scare anim,0,60,7,7.714285714285714,0,Unknown
3064,deaths,,bigamist wife charg death second pregnant wife child 8 news,0,133,21,5.380952380952381,1,Unknown
5683,floods,New Jersey,rain nj flash flood desert grief tax,1,96,18,4.388888888888889,0,Unknown
3921,devastated,The Meadow,foot love int everi anymor album red devant record becaus,0,133,19,6.052631578947368,0,Unknown
6034,hazardous,"British Columbia, Canada",skinni jean hazard health socialnew,1,78,9,7.777777777777778,1,Canada
4673,engulfed,,michael engulf jumper,0,34,6,4.833333333333333,0,Unknown
6984,massacre,Cottonwood Arizona,tell rescind medal honor soldier massacr wound knee sign,1,143,22,5.545454545454546,0,Unknown
4219,drowned,United States,pussi deep drown twice,0,38,7,4.571428571428571,0,United States Minor Outlying Islands
5018,eyewitness,Jammu and Kashmir,eyelid account survivor hiroshima glean number oral histori project,1,117,15,6.8,0,Unknown
2612,crashed,,major hamlyn shaheen pilot mix heli crash mansha,1,88,12,6.416666666666667,0,Unknown
6580,injury,Russia,big babi climb thing wheel hawkin knee injuri belter sri cook ur beauti ass punish,0,139,23,5.086956521739131,0,Russian Federation
3617,desolation,St. Louis Mo.,wow win free hobbit esol smug uv digit download code gin 9 list,0,124,20,5.25,1,Unknown
799,battle,UK Great Britain ,ad video playlist world tank battl assist mod bat chat art boom,0,120,20,5.05,0,Unknown
9941,trouble,,bad voic hear nikki troubl voic mom,0,81,17,3.764705882352941,0,Unknown
992,blazing,,32 inch dynasti,0,41,7,5.0,0,Unknown
3917,devastated,,good lol,0,40,5,7.0,0,Unknown
4961,explosion,New York,new explosionproof temper glass screen protector film blackberri z1 read,0,139,16,7.75,0,Unknown
6519,injuries,Carterville,watermil high school coach prepar gateway injuri,1,84,9,8.444444444444445,0,Unknown
779,avalanche,"Denver, CO",chanson sen come deal coloradoavalanch avalanch,1,108,10,9.9,2,"Congo, The Democratic Republic of the"
3802,detonate,Milton/Tallahassee,apollo brown ft mop devon,1,57,7,7.285714285714286,0,Unknown
5087,famine,Ukraine,reuter russian food crematoria provok outrag amid crisi famin memori,1,124,12,9.416666666666666,0,Ukraine
4823,evacuation,,vietnam war patch hospit highland medic,1,107,11,8.818181818181818,0,Unknown
9705,tornado,,hey let challeng tornado tag tlc match winner,0,91,15,5.133333333333334,0,Unknown
6148,hijack,Nigeria,crime hijack lorri use arrest photo human right,1,122,14,7.714285714285714,1,Nigeria
9511,terrorist,Chennai,pakistan disown arab disown state denial terrorist captur aliv,1,130,17,6.705882352941177,0,Unknown
4719,evacuate,,cannon ball ocean japan,1,66,13,4.153846153846154,0,Unknown
8741,sinking,Coventry,feel like sink unhappi quiz,0,109,14,6.857142857142857,0,Unknown
3404,derail,"Washington, D.C.",metro train derail downtown dc,1,84,12,6.083333333333333,0,Unknown
7456,obliteration,Canada ,need arcad shooter fix eat empti onli run obit d buy cod titl steam,0,143,27,4.333333333333333,0,Canada
3824,detonate,Worldwide,52214904 5139055 nuke plea target hilversum plea devon 800 meter surfac,1,90,12,6.583333333333333,0,Unknown
10621,wounded,"Brooklyn, NY",liabl sound like wound aim sure sex good lol,0,74,16,3.6875,0,Unknown
7268,nuclear disaster,"Dhaka, Bangladsh",want hiroshima nagasaki nuclear bomb disea beauti wordless peac save human civil,1,144,23,5.304347826086956,0,Unknown
1328,bloody,"Santa Cruz, CA",black friday turn blood shop mysteri,0,85,10,7.5,1,Central African Republic
4679,engulfed,California,whi decid workout today bodi feel like engulf mass fieri disdain,0,103,21,3.9523809523809526,0,Unknown
2128,catastrophe,America | New Zealand ,taylor cara aka catastroph mother chuck scene bad blood vote mas,0,140,18,6.833333333333333,1,Unknown
6075,heat wave,liverpool ,greatbritishbakeoff love know nice weather happen miss heat wave,0,111,20,4.6,1,Unknown
10692,wreck,"Lebanon, Tennessee",waterton gazett owner charg wreck,1,63,7,8.142857142857142,0,Lebanon
8471,screamed,18 Û¢ CC,kid leadership camp come work today ask bathroom inner asb kid scream lot miss camp,0,134,27,4.0,0,Unknown
7095,military,,3 titan warriorcord 100 foot athen militari 550 paranoid milc5040h type iii 7 strand 516 di,0,132,19,6.0,1,Unknown
1837,burned,Long Island NY & San Francisco,spend 17 minut walk innkeep 90 calori burn lossit,0,70,11,5.454545454545454,1,Unknown
5366,fire truck,United States,rip fire truck servic bodi p450 fire fight rescu safeti equip transport,0,121,15,7.133333333333334,1,United States Minor Outlying Islands
9716,tragedy,,fli tragedi mp live recount horror coach train fling water,1,137,23,5.0,0,Unknown
3191,deluge,World,houghjeff crap content market delug dougkessl bob b2bagenc slideshar contentmarket,0,134,14,8.642857142857142,3,Unknown
3116,debris,,union debri sure flight 370 offic new york time,1,102,15,5.866666666666666,0,Unknown
3058,deaths,,whi osf japan die fedayeen blood inca inca rifl blame soldier death mod,1,139,22,5.363636363636363,1,Unknown
1518,body bags,"southwest, Tx",shoot shit till bodi bag,0,35,8,3.5,0,Unknown
1316,bloody,"peekskill. new york, 10566 ",blood mari sink beet juic,0,58,8,6.375,0,Unknown
10671,wounds,Shady Pines ,scroll find debut exact start point wind run deep,0,120,24,4.0,0,Unknown
1129,blight,"Calgary, Alberta",great pair like coupl graywarden fight blight,0,86,14,5.214285714285714,0,Unknown
1625,bombed,"Ikeja, Nigeria",70 year ago today unit state america bomb hiroshima japan,1,74,13,4.769230769230769,0,Nigeria
10616,wounded,"Washington, D.C.",polic chief assur crowd officerrel shoot invest,1,139,15,8.333333333333334,0,Unknown
8591,screams,texas,scream mother,0,47,6,7.0,0,Unknown
3979,devastation,ITALY,thorium radiant weapon scandal murder environ devant video,1,108,11,8.909090909090908,1,Unknown
6454,injured,Ikorodu,photo 17 peopl kill 25 injuri dead saudi mosqu suicid attack,1,105,15,6.066666666666666,0,Unknown
4054,displaced,Asia Pacific   ,myanmar s display rohingya littl point return prison lik conditionspriv,1,139,14,9.0,3,Unknown
7888,quarantined,,oc73x mhtw4fnet offic alabama home quarantin possibl bola case washington post,1,97,13,6.3076923076923075,0,Unknown
10849,nan,,gas thing explod hear scream street smell gas,1,91,19,3.8421052631578947,0,Unknown
8777,siren,The TARDIS,pc account hack someon tri pull 1200 buck nsf idea whi,0,143,28,4.142857142857143,0,Unknown
3984,devastation,EVERYWHERE,citi look like subject hiroshima bomb hintdevast beyondthebomb,1,140,19,6.421052631578948,2,Unknown
2362,collapsed,"CAMARILLO, CA",wish mat mundi mcguir stand collar,1,110,15,6.4,1,Central African Republic
9592,thunder,,loud thunder hear,0,45,8,4.625,0,Unknown
335,annihilated,Û¢ Views From The Six Û¢,complet nihil czech paul keegan time aliv,0,73,13,4.6923076923076925,0,Unknown
2219,chemical emergency,http://www.amazon.com/dp/B00HR,usa break news chemic spillevacuationsr cross emerg,1,89,8,10.25,0,Unknown
8377,ruin,,let asshol ruin night,0,40,8,4.125,0,Unknown
2396,collapsed,wherever-the-fuck washington,oh wow heart collar cool cri cool cool,1,66,11,5.090909090909091,0,Unknown
8846,smoke,Rio de Janeiro,smoke,0,22,4,4.75,0,Unknown
424,apocalypse,"San Antonio-ish, TX",dad buy look like scienc doc read actual spend public apocalyps,1,137,26,4.3076923076923075,0,Unknown
7881,quarantined,Ebola,alabama home quarantin possibl bola case abul sit outsid univel alabama,1,131,17,6.764705882352941,1,Unknown
713,attacked,,christian attack muslim templ mount wave ira flag pamela geller,1,122,18,5.833333333333333,0,Unknown
1280,bloody,,infect blood ear pier alway fun,0,46,7,5.714285714285714,0,Unknown
4268,drowning,scandinavia,dare play victim drown year,0,65,12,4.5,0,Unknown
10352,weapons,Regalo Island,weapon twin knife ojoubot,0,29,4,6.5,1,Unknown
4698,epicentre,London/Surrey ,index remark punk idea place epicentr new postcapit epoch,0,101,17,5.0,0,Unknown
2755,curfew,Ankara - Malatya - ad Orontem,ara news report jan fighter infil ashrafiyah district aim carri suicid attack pg imp curfew,1,140,22,5.409090909090909,0,Unknown
398,apocalypse,,noth jocelyn birthday apocalyps,0,49,7,6.142857142857143,0,Unknown
456,armageddon,probably the strip club,beat armageddon hsu hao flawless tri,0,79,16,3.9375,0,Unknown
3495,derailed,NYC,sad biker breakdown derail pro democraci work undergo,1,127,13,8.846153846153847,0,Unknown
