id,keyword,location,text,target,num_char,num_words,avg_word_length,num_hashtags,country
7894,quarantined,China,hot credit new content polic effect mani horribl subreddit ban quarantin firebreak best,0,136,17,7.0,3,China
6882,mass murder,New Sweden,medium need stop public mass murder mani sick peopl want eye world medium,0,135,22,5.181818181818182,0,Unknown
10006,tsunami,,worri,0,34,4,7.75,0,Unknown
2468,collided,"St. Joseph, Minnesota",train collid india plea pray victim famili rescuer,1,87,14,5.285714285714286,0,Unknown
3419,derail,,continu derail iran nuclear deal sure tonight golden oh yeah,1,92,14,5.571428571428571,1,Unknown
3828,detonate,"Morioh, Japan",noth stand devon killer queen,0,99,18,4.555555555555555,0,Japan
7340,nuclear reactor,"Fort Calhoun, NE",aug 5 fort callous nuclear station 100 cepac today accord nrc,0,111,17,5.588235294117647,0,Montenegro
4221,drowned,IG: AyshBanaysh,sometim logic drown emit surfac point,0,81,14,4.857142857142857,0,Unknown
8530,screaming,,follow town advertis coutur channel scream walk sign pls,0,138,24,4.791666666666667,0,Unknown
790,avalanche,Canada,feat watch bts inc music video avalanch,0,114,15,6.666666666666667,2,Canada
2925,danger,World,permit bear hunt danger outnumb actual bear linen florida fir st petersburg,0,136,18,6.611111111111111,1,Unknown
8508,screaming,"Moore, OK",s hot sing scream,0,57,9,5.444444444444445,0,Cook Islands
4456,electrocuted,New York,woman electrocut red redwood videoclip,0,69,7,9.0,4,Unknown
10406,whirlwind,New York,seattl tacoma portland whirlwind,1,72,8,8.125,0,Unknown
7444,obliterated,,think ill obit tonight,0,36,6,5.166666666666667,0,Unknown
3009,death,PROV,death threat nigra life gon,0,50,11,3.6363636363636362,0,Unknown
10852,nan,,mh370 aircraft debri find la reunion miss malaysia airlin,1,122,18,5.833333333333333,4,Unknown
8163,rescuers,,video pick bodi water rescuer search hund migrant mediterranean boat carri,1,136,21,5.523809523809524,0,Unknown
1238,blood,Dime's Palace,blood,0,31,8,2.875,0,Unknown
2723,crushed,ph,diamond piec charcoal hand stress hard press everi crush corp,1,136,24,4.708333333333333,0,Unknown
4042,disaster,nearest trash can ,d like think photon everi time pic think gosh diseas xd,0,122,27,3.5555555555555554,0,Unknown
4874,explode,"New Orleans, Louisiana",guy reach foot load shoulder spin hit loadexplod,0,143,19,6.526315789473684,2,Unknown
3676,destroy,,silli onli countri destroy world world secur,1,139,22,5.318181818181818,0,Unknown
9481,terrorism,,realli cannon condemn enter group base action hearthwar unit terror,1,134,19,6.105263157894737,0,Unknown
8168,rescuers,,video pick bodi water rescuer search hund migrant mediterranean boat carri,1,136,21,5.523809523809524,0,Unknown
7930,rainstorm,online ,landslid italian alp kill rome reuter peopl kill sever rainstorm,1,140,22,5.409090909090909,0,Unknown
6128,hellfire,"Denver, Colorado",wow bet blame huh,0,55,10,4.6,0,Unknown
6665,landslide,USA,speak memori debat second know al ronald reagan landslid romp elect day 1980 m,0,136,17,7.0588235294117645,0,United States
1865,burned,,watch bad fool burn coverag year dat dude allur practic squad materia,1,101,18,4.666666666666667,0,Unknown
10273,war zone,Southern California,drive suck case becaus know desk look like war zone everyon need mode,0,134,27,4.0,0,Unknown
9119,suicide bomb,Homs- Syria,11 soldier kill isi suicid bomb air base east home syria news maman isi home,1,125,21,4.904761904761905,2,Unknown
9139,suicide bomb,Nigeria,ayr old boy pic pkk suicid bomber devon bomb turkey armi trench,1,122,16,6.6875,0,Nigeria
512,army,,vote direct vs queen th round fanarmyfaceoff,0,107,14,6.714285714285714,3,Unknown
5757,forest fires,Cape Cod,photo blue sourc,1,82,7,10.857142857142858,0,Unknown
1354,blown up,Nowhere Islands/Smash Manor,thank let stay sinc manor blow buddi,0,121,20,5.1,0,Unknown
10340,weapons,"Ely, Cambridgeshire",incredul continu outcri welfar wast taxpay money similar object 100bn nuclear weapon,1,133,21,5.380952380952381,0,Unknown
9923,trouble,Chasing My Dreams w/Jass??,problem shit work trna stay troubl abu big home,0,99,18,4.555555555555555,0,Unknown
1054,bleeding,,head like yo nose bleed,0,43,7,5.285714285714286,0,Unknown
5209,fatalities,"Lima, Ohio",messag board display updat traffic fatal 582 new messag begin today traffic death 616 slow worker,1,140,22,5.409090909090909,0,Unknown
4273,drowning,"Madison, WI",believ rain newli plant map tree actual drown,1,114,19,5.052631578947368,0,Malawi
212,airplane accident,Indonesia,votejkt48id mbataweel rip unladen famili member kill airplan acid,1,95,13,6.384615384615385,4,Indonesia
2042,casualties,,hear use purpl heart manufactur bc casualti expect,1,127,19,5.7368421052631575,1,Unknown
6383,hostages,The Universe,contd sinar refer pg document group togeth yazdi hostag day follow massacr 2,1,140,24,4.875,3,Unknown
8410,sandstorm,USA,watch airport swallow sandstorm minut,1,91,14,5.571428571428571,0,United States
2350,collapse,Behind The Obama Curtain,green tax revenu collaps debt crisi continu,1,79,9,7.777777777777778,0,Unknown
9886,traumatised,London,sad kid compani close talk thousand traumat young peopl suffer,0,135,20,5.8,0,Unknown
2550,collision,"USA, WA",anti colli rear gadget technolog,0,63,6,9.666666666666666,2,United States
3997,devastation,Jackson TN,current blast benedict sanelesstheori metal devant radio,0,102,10,9.2,2,Unknown
3176,deluge,,strang caustic geographi portion till voic delug byityf,0,97,12,7.166666666666667,0,Unknown
74,ablaze,India,man wife year jail set ablaz nice,1,76,11,5.909090909090909,0,India
3927,devastated,Chester ,devant,0,32,3,10.0,0,Unknown
3218,deluged,,busi delug invoic stand colour shape like ris togeth pay pile,0,132,24,4.541666666666667,0,Unknown
437,apocalypse,,geekapocalyp pm gmt hess play dark soul 2 day 9 etc,0,114,14,7.214285714285714,1,Unknown
303,annihilated,,nihil status duc mba behalf east street career erm,0,105,16,5.625,0,Unknown
8453,screamed,sneaking glances at Thancred,scream hit tweet,0,52,7,6.571428571428571,0,Unknown
8697,sinking,North East Unsigned Radio,non play sink fast north east ensign radio listen,0,101,15,5.8,1,Unknown
1826,burned,Massachusetts,uh huh onli burn onc know fire hurt robbi ross throw home run derbi star game redox,0,138,27,4.148148148148148,1,Unknown
3101,deaths,"ÌÏT: 10.614817868480726,12.195582811791382",bigamist wife charg death second pregnant wife child 8 mother,1,133,21,5.380952380952381,0,Unknown
6499,injuries,"Saskatchewan, Canada",u blame coach manag penalti defenc injuri cur probabl good way rider,0,133,23,4.826086956521739,1,Canada
1979,bush fires,Jamaica,slash burn blame bush fire western st thoma,1,82,11,6.545454545454546,0,Jamaica
2702,crush,,kenni holland crush da vida,0,27,5,4.6,0,Unknown
727,attacked,"San Francisco, CA",kelli osborn attack racist donald trump remark latino view,1,103,14,6.428571428571429,0,Central African Republic
1335,blown up,"801 SL,UT",damn green blow inning,0,46,9,4.222222222222222,0,Austria
7012,mayhem,"North Dartmouth, Massachusetts",read right left,0,41,7,5.0,0,Unknown
484,armageddon,,christian unit israel cuff jew convert soon die armageddon,0,136,16,7.5625,4,Unknown
8213,riot,,riot kit bah new concept gear come autumn want menswear fashion urbanfashion,0,129,17,6.588235294117647,3,Unknown
8665,sinkhole,Êwagger!ÌominicanÌ÷,lomasvisto thousand hipster fear lose giant sinkhol devour brooklyn intersect cadenadeseguidor,1,136,13,9.538461538461538,2,Unknown
3795,destruction,,rss russia begin mass district kill import food,1,87,10,7.6,0,Unknown
1555,bomb,,hiroshima mark 70 year sinc bomb,1,58,7,7.428571428571429,0,Unknown
9441,survivors,,rememb hiroshima,1,69,4,16.25,1,Unknown
4857,evacuation,The Empire/First Order,good play begin death star near complet,0,140,21,5.714285714285714,0,Unknown
1767,buildings burning,,agent burn build loot store,0,64,10,5.5,0,Unknown
161,aftershock,Somewhere Only We Know ?,guess actual want free aftershock tc,0,60,11,4.545454545454546,0,Unknown
4712,evacuate,,chicago ap organ lollapalooza reopen music festiv threat storm prompt,1,139,23,5.086956521739131,0,Unknown
4759,evacuate,"London, England",wow fifa pre season tournament career mode blood hell build whore,0,99,15,5.666666666666667,2,Unknown
9719,tragedy,"Pennsylvania, USA",d tragedi wonder nose,0,81,12,5.833333333333333,0,United States
10733,wreck,scumbernauld,emit wreck watch emmerdal,0,41,6,6.0,0,Unknown
2361,collapsed,,great british ltbgtbakeltbgt dorset ltbgtchocolateltbgt gateau collaps jan,0,139,13,9.76923076923077,0,Unknown
10091,typhoon,"Washington, DC",massiv typhoon head taiwan,1,59,6,9.0,0,Unknown
6819,loud bang,Kenya,nikoniko12022 break news confirm hear loud bang nearbi appear blast wind neighbour ass,0,138,24,4.791666666666667,0,Kenya
6430,hurricane,NYC,mr t stop wear gold chain 2005 becaus think insult peopl lose everi hurrican katrina,0,140,25,4.64,0,Unknown
2103,casualty,"Kansas City, MO",small casualti way colorado,1,60,8,6.625,0,Macao
5563,flood,United States,jul cancel flash flood warn bell harland knox ky,1,85,12,6.083333333333333,1,United States Minor Outlying Islands
2561,crash,"Aix-en-Provence, France",alright crash exhaust,0,57,9,5.444444444444445,0,France
10439,wild fires,Twitterville,collect articl video west coast wild fire,1,88,13,5.846153846153846,0,Unknown
9026,stretcher,DMV,s stretcher want,0,56,12,3.75,0,Unknown
1996,bush fires,Loughborough.,plea global warm realli work california australia catastroph bush fire,1,127,17,6.470588235294118,0,Unknown
6973,massacre,Ireland,remem massacr civilian hiroshima,1,76,9,7.555555555555555,1,Ireland
1495,body bags,United Kingdom,woman buck casual stylish shoulder handbag pocket cross bodi bag white,0,99,12,7.333333333333333,0,United Kingdom
1658,bombing,,japan mark anniversari hiroshima atom bomb,1,79,9,7.888888888888889,0,Unknown
6317,hostage,Roaming around the world,islam state group egypt threaten kill croat hostag,1,83,11,6.636363636363637,0,Unknown
6376,hostages,,year sinar massacr yazdi blast lack action hostag,1,104,15,5.933333333333334,1,Unknown
6208,hijacker,,media airplan hijack testa earn distinct diver htarvrg,1,76,9,7.555555555555555,0,Unknown
6388,hurricane,"#1 Vacation Destination,HAWAII",hurrican guillermo live noaa track loop wedaug5th,1,134,13,9.307692307692308,0,Unknown
7612,pandemonium,"VONT ISLAND, LAGOS",pandemonium aba woman delia babi face photo,0,86,11,6.909090909090909,0,Unknown
9942,trouble,,yeah barber dint cut hair short egg troubl,0,129,23,4.6521739130434785,0,Unknown
10401,whirlwind,London,new york whirlwind day activ new york breakfast millennium hotel unit nation plaza lunch,0,140,20,6.05,0,Unknown
8279,rioting,,time high profit sign nfc citi riot wesley verhoek household donovan,1,136,25,4.48,2,Unknown
6629,inundated,United States,tech data overload grow demand context structur world anund inform news,0,136,18,6.611111111111111,2,United States Minor Outlying Islands
7026,mayhem,"Pueblo, Colorado",campaign farrel zach galifianaki commit comic mayhem hilari polit farc 4,0,129,17,6.647058823529412,0,Unknown
9531,terrorist,MAD as Hell,abbswinston zionist terrorist kidnap 15 palestinian overnight terror palestinian villag,1,133,15,7.933333333333334,3,Unknown
10394,whirlwind,Thailand,weather forecast thailand whirlwind come 2 septemb,1,91,11,7.2727272727272725,0,Thailand
6978,massacre,Stay Tuned ;) ,rise coat charleston massacr walter scott black twitter broad,1,131,19,5.947368421052632,0,Unknown
4216,drowned,Colorado Springs,jacksonvill famili band togeth memori plan toddler florida,0,136,16,7.5625,0,Unknown
4084,displaced,Manila,philippin protect intern display person warn un expert diplomat,1,107,13,7.3076923076923075,0,Unknown
4775,evacuated,"Manchester, UK",trafford centr film fan angri odeon cinema follow fal fire alarm,1,133,15,7.933333333333334,0,Ukraine
241,airplane accident,Fashion Heaven. IG: TMId_,phone look like car ship airplan acid terribl,0,68,13,4.3076923076923075,0,Unknown
10436,wild fires,Houston,wild fire blacken northern california march harri counti becom tinder box,1,108,13,7.3076923076923075,0,Unknown
4425,electrocute,,shed love come help sea electrocut,0,94,16,4.8125,0,Unknown
8737,sinking,London,slowli sink wast,0,36,5,6.4,0,Unknown
1540,bomb,Manchester,guy scare real know ill bomb,0,78,15,4.266666666666667,0,Unknown
10367,weapons,West,wwii memori plus lesson hiroshima need nuclear weapon denver bill rapid seattl cheyenn,1,140,17,7.294117647058823,5,Western Sahara
7412,obliterated,"Waterloo, ON",dude obit meek mill judg book cover,0,101,16,5.375,0,Tonga
5454,first responders,"Stalybridge, Tameside",999day emerg servic display meet brave polic firefight respond help safe,1,134,20,5.75,1,Unknown
5229,fatality,"Enterprise, NV",fatal,0,33,2,15.5,0,Unknown
2625,crashed,"Victoria, Tx.",intactmh370partliftsoddsplaneglidednotcrashedintosea answer,1,121,6,19.333333333333332,1,Unknown
9181,suicide bomber,,whi talk risk suicid bomber hide migrant stow aboard eurotunnel train,1,134,22,5.090909090909091,0,Unknown
6611,inundated,swindon,listen grandad talk holiday great want anund train photo,0,111,21,4.333333333333333,0,Unknown
1900,burning,"Paradise, NV",uh huh demon hunter burn crusad v 20 thing,0,93,13,6.153846153846154,0,Unknown
4498,emergency,Michigan,whistleblow lawsuit accus supervisor sleep job onc accord offic,0,136,18,6.388888888888889,0,Unknown
7451,obliteration,,dead right obit,0,82,14,4.928571428571429,0,Unknown
6824,loud bang,Kenya,kmatakobot break news confirm hear loud bang nearbi appear blast wind neighbour ass,0,137,24,4.75,0,Kenya
9401,survivors,Port Williams NS,patientreport outcom longterm survivor metastat correct cancer british journal surgeri,1,132,15,7.866666666666666,0,Unknown
6593,inundated,"Boston, Massachusetts",bodi shop anund car dent hail good news insur pay bad news stick deduct wc1b,1,127,22,4.7272727272727275,1,Unknown
2126,catastrophe,"Morganville, Texas.",disc sweet need becaus sweet sound like total emit catastroph,0,106,18,4.944444444444445,0,Unknown
7056,meltdown,,meltdown deni instagram comment,0,68,9,6.666666666666667,0,Unknown
10268,war zone,The D,debatequestionswewanttohear u start noth war u b 2 2 warton send ur son and/or daughter 2 fight,1,140,24,4.875,1,"Congo, The Democratic Republic of the"
1119,blew up,"Queens, NY",mao light skin guy blow twitter talk ugli kid,0,87,19,3.6315789473684212,0,Unknown
5509,flames,Bacon,sean bro admit sean flame sean,0,109,19,4.7894736842105265,0,Unknown
435,apocalypse,,mineshaft night lucki block mod bob apocalyps wither 20 mod showcas popularmmo,0,134,17,6.9411764705882355,0,Unknown
5079,famine,Texas,famin come end bluebel,1,63,9,6.111111111111111,1,Unknown
7847,quarantined,,link credit new content polic effect mani horribl subreddit ban quarantin,0,124,16,6.8125,0,Unknown
2983,dead,"Sochi, KDA, RU",hello look mod cold ice site link download dead share thank,0,140,28,4.035714285714286,0,Nauru
3093,deaths,Blackpool,cancer equal 25 death blackpool know sign save life beclearoncanc,1,142,19,6.2631578947368425,2,Unknown
9731,tragedy,,fli tragedi mp live recount horror coach train fling water,1,137,23,5.0,0,Unknown
5293,fear,Alliston Ontario,forfeit year fantasi footbal pool fear win n ass kick,0,140,22,5.409090909090909,0,Unknown
10045,twister,,twister danc game danc consol instruct 5 pre load song,0,117,13,8.0,0,Unknown
2385,collapsed,"Spokane, WA",petit heartless owner whip hor collar tell aim act,0,128,20,5.45,0,Botswana
6928,mass murderer,Chester Football Club,mass murder,0,81,15,4.466666666666667,0,Unknown
6660,landslide,Texas,landslid trump 255 bush 125,0,88,9,8.88888888888889,1,Unknown
7254,nuclear disaster,"New York, NY",physic sen help preserv memori 2011 trial disea 84 jaw fish nuclear minamisoma,1,126,15,7.466666666666667,3,Unknown
7467,obliteration,828/704(Soufside)/while looking goofy in NJ,02 03 50 end ja like obit,0,79,16,4.0,0,Unknown
10723,wreck,United States,amazon slander trap team flip wreck charact pack 453 045 949 994 sale,0,130,18,6.277777777777778,1,United States Minor Outlying Islands
8161,rescuers,,video pick bodi water rescuer search hund migrant mediterraneo,1,136,18,6.611111111111111,0,Unknown
8028,refugees,,read 12000 nigerian refug repair cameroon,1,83,9,8.333333333333334,0,Unknown
10522,wildfire,,machin realli captur attend helicopt firefight wildfir oregon easternoregon,1,128,12,9.75,5,Unknown
8071,rescue,Sand springs oklahoma,chanc aim rescu 3 new post animalrescu,0,105,12,7.833333333333333,1,Unknown
2100,casualty,"Massachusetts, USA",japan nuke program albeit success casualti stim grind war million,1,133,22,5.090909090909091,0,United States
6106,hellfire,Right next to Compton,mistak boss wor caus job ver work boss dint chang,0,133,25,4.36,0,Unknown
9744,tragedy,,fli tragedi mp live recount horror coach train fling water,1,137,23,5.0,0,Unknown
4330,dust storm,,learn economi south dakota dust storm year colleg hubert humphrey,1,120,22,4.454545454545454,0,Unknown
5132,fatal,,california man face manslaught charg sunday wrong fatal crash,1,137,16,7.625,0,Unknown
467,armageddon,Here And There,armageddon,1,34,2,16.5,0,Unknown
5816,hail,antoine fisher ,man kno,0,33,7,3.857142857142857,0,Unknown
5751,forest fires,,year forest servic spend half annual budget fight fire climatechang,1,137,20,5.9,1,Unknown
646,attack,"Dallas, TX",stay vigil civil liberti constant attack nativehuman religion,1,107,11,8.727272727272727,2,Unknown
3652,destroy,"San Diego, CA",plot futur totalitarian govern employ know fireman seek destroy literatur,0,140,20,6.0,0,Central African Republic
3959,devastation,,yeah shock factor rope peopl devant anger,0,117,22,4.363636363636363,0,Unknown
721,attacked,Peshawar,onli troll pol rival later bus attack famili later bus loser,0,130,22,4.954545454545454,0,Unknown
2873,damage,Unknown,yeah fast extrem high damag want fast u,1,138,27,4.148148148148148,0,Unknown
3659,destroy,,n25 mhtw4fnet watch michael jordan absolut destroy memebait camper foxsportscom,0,98,12,7.0,0,Unknown
4065,displaced,"48.870833,2.399227",9000 photograph 1800s british mandat palestin trace palestinian,1,114,15,6.666666666666667,0,Unknown
1954,burning buildings,"Victoria, British Columbia",heavi smoke pour build fire port coquitlam,1,108,13,7.384615384615385,0,Unknown
2445,collide,"Austin, TX",word slip soul coincid fine euratom spell collid,0,113,17,5.705882352941177,0,Unknown
2889,damage,Charlotte NC,repo hit ruin roadwaypropey damag 15901 statesvil rd,1,74,10,6.5,0,Unknown
3587,desolate,Temporary Towers,look esol end world stuff gorgeous,0,65,11,5.0,0,Unknown
2912,danger,Worldwide,check rock preview danger zone come soon artistsunit,0,140,15,8.4,2,Unknown
6140,hijack,"New York, NY",hijack bona fide islay confirm true incid homosexu gabi woman,1,139,23,5.086956521739131,0,Unknown
10869,nan,,giant crane hold bring collar nearbi home,1,83,11,6.636363636363637,0,Unknown
9761,trapped,call me peach or sam lo,trap damn gas pump sum fuck dickhead,0,84,17,4.0,0,Unknown
972,blaze,,huh leo start year sinc peopl blaze,0,125,21,5.0,0,Unknown
7187,mudslide,Ireland,rubber mudslid laugh,0,45,5,8.2,0,Ireland
2954,dead,Afghanistan,17 dead afghanistan aircraft crash afghan militari helicopt crash remot region s,1,137,20,5.85,0,Afghanistan
2370,collapsed,,bay district coach learn cpr sure medic cour panama citi athlet collar field coach,1,138,19,6.315789473684211,0,Unknown
9657,thunderstorm,,usnwsgov sever weather statement issu august 05 1038pm edt news sever thunderstorm warn,1,136,18,6.611111111111111,1,Unknown
2491,collided,Cherry Creek Denver CO,2 car collid 1 crash build car collid intersect send vehicl crash,1,137,20,5.9,0,Unknown
7553,outbreak,,mad catastroph outbreak world war collar,1,120,17,6.117647058823529,0,Unknown
8190,rescuers,,fear miss migrant med rescuer search survivor boat carri mani 600 migrant,1,137,20,5.9,0,Unknown
3144,debris,,debri confirm mh370 relat hope discov crash site video,1,114,15,6.666666666666667,1,Unknown
9577,thunder,,thing like thunder,0,51,11,3.727272727272727,0,Unknown
2409,collide,"Melton, GA",find collid,0,53,7,6.714285714285714,0,Gabon
4677,engulfed,"Rochester, NY",cake engulf flame literarycak,0,51,8,5.5,1,Unknown
1992,bush fires,somewhere outside,bush fire scaryeven scari fight,1,68,12,4.75,0,Unknown
10173,violent storm,Worldwide,violent radio play agoni storm apocalyps tune player,0,105,15,6.0,0,Unknown
3851,detonation,,ignit knock devon sensorsenso standard s57,0,100,8,11.625,0,Unknown
877,bioterror,,feel long transport bioterror germ wake anthrax lab mishap,1,112,16,6.0625,0,Unknown
9854,trauma,"Chicago, Illinois",80 faculti member push univel overturn ban trauma center protest,1,137,15,8.2,0,Unknown
7010,mayhem,,mayhem beauti,0,19,3,5.666666666666667,0,Unknown
8624,seismic,"Bokaro Steel City, Jharkhand",u control futur india subject explor seismic maintain elect meehan,0,124,17,6.235294117647059,0,Unknown
3685,destroy,he/him or she/her (ask),destroy hous,0,17,3,5.0,0,Unknown
3083,deaths,UGA '15 Alumnus - Economics ,annoy crust live matter head peopl actual support caus hate black death attend,0,138,23,5.043478260869565,0,Unknown
977,blaze,,dame girl smooth c,0,33,7,3.857142857142857,0,Unknown
1124,blew up,"Ottawa, Canada",zani blow twitter,0,26,5,4.4,0,Canada
802,battle,,barrack petersen fount battl bow sure head cast vote,0,138,21,5.523809523809524,0,Unknown
3679,destroy,New England,56 destroy reg c compet enter region b oversatur yes brockton reg commonwealth ppc,1,137,21,5.380952380952381,0,Unknown
2660,crush,"San Antonio, TX",woman crush,0,39,4,9.0,0,Unknown
4489,electrocuted,,god damn electrocut,0,39,7,4.714285714285714,0,Unknown
7581,outbreak,"FCT, Abuja ",th person die ny legionnair dista outbreak sea,1,82,10,7.3,1,Unknown
10524,wildfire,,impact calwildfir great recoveri tip help aftermath,1,125,19,5.631578947368421,1,Unknown
6243,hijacking,"perth, australia ",hot antenna hijack comput send datum sound wave black hat 2015 firebreak good,0,119,16,6.4375,3,Unknown
10208,volcano,"Perth, Australia",jester virgin cancel bali flight becaus ash mount rang volcano,1,117,17,5.9411764705882355,0,Australia
6188,hijacker,San Francisco Bay Area,gov brown allow parol 1976 chinchilla school bus hijack schonfeld,0,128,14,8.214285714285714,0,Unknown
3519,derailment,,mp train derail villag youth save mani live india,1,107,11,8.727272727272727,1,Unknown
2939,danger,,girl wanna save like danger health tri somebodi wanna somebodi el,0,109,22,4.0,0,Unknown
2796,curfew,,5 hour late curfew pray dog doe bark unlock door,0,98,19,4.2105263157894735,0,Unknown
8738,sinking,Rhyme Or Reason?,tribe sink everyday fast year titan disea,1,102,18,4.722222222222222,1,Unknown
6874,mass murder,Anonymous,pass know mass murder place faroeisland everi year,1,134,18,6.5,1,Unknown
5922,harm,The South & WestCoast ,world bro wanna harm come way ma lil upset right,0,101,24,3.25,0,Unknown
4326,dust storm,CA via Brum,answer friend yell wind late articl read share thank,0,140,19,6.421052631578948,0,Unknown
7937,rainstorm,Earth,landslid italian alp kill rome reuter peopl kill sever rainstorm th,1,136,20,5.85,0,Unknown
658,attack,,93 blast accus yea yaqub die karachi heart attack dubai,1,94,13,6.3076923076923075,1,Unknown
3447,derail,eritrean,tire alllivesmatt peopl onli derail blacklivesmatt anth live mao,0,136,22,5.2272727272727275,2,Unknown
10315,weapon,?????,abe govern clear grenad weapon,1,60,9,5.777777777777778,0,Unknown
6343,hostages,NYC metro,holmsen describ 96 world cup loss hostag,0,57,9,5.444444444444445,0,Unknown
8043,refugees,tripoli international airport,thank help mani peopl need world,0,141,21,5.761904761904762,0,Unknown
4646,emergency services,"Los Angeles, CA",missionhil nur resist nur emerg depart time provid health servic,0,141,18,6.888888888888889,2,Central African Republic
7352,obliterate,Seattle,fun instagram job bush earli week onli doe want obit plan parenthood bu,0,142,20,6.0,2,Unknown
1345,blown up,"July 11th, 2015. ?",mention blow wwf,0,46,10,3.7,0,Unknown
10655,wounds,"Rutherfordton, NC",help love suffer self esteem wind today,0,128,16,7.0625,0,New Caledonia
77,ablaze,Anaheim,polic arsonist deliv set black church north carolinaablaz,1,95,10,8.6,0,Unknown
2536,collision,Saint Lucia,tell tragic mid - coli claim life young man ride motorcycl,1,139,19,6.368421052631579,0,Saint Lucia
9538,terrorist,Charleston S.C.,int iron anniversari hiroshima current presid help terrorist nation acquir nuclear weapon traitor,1,138,21,5.619047619047619,1,Unknown
3667,destroy,,150 free bet resist boylesport casino luck destroy,0,120,14,7.642857142857143,2,Unknown
8136,rescued,"Pennsylvania, USA",pet r like famili love aim 2 pet rescu break heart aim mistreat,0,143,26,4.538461538461538,0,United States
269,ambulance,,twelv fear kill pakistani air abul helicopt crash,1,110,11,9.090909090909092,0,Unknown
5707,floods,Rio de Janeiro,gas soon maintain end everyon flood server observ destroy extrem load maintain start anew,0,127,17,6.411764705882353,0,Unknown
2108,casualty,,franc repay russia warship delia economi sanction,0,136,17,7.0,0,Unknown
7643,pandemonium,California,truli scene chao unpric frenzi pandemonium utter discord anyon surviv mania astound,1,139,20,6.0,0,Unknown
2516,collision,Oregon,2 dead 2 injuri head colli menai spur highway,1,82,12,5.916666666666667,0,Unknown
8511,screaming,Justin and Ariana follow,fan scream fuck loud,0,60,8,6.625,0,Unknown
10339,weapons,"Houston, TX",sorri resort weapon settl cometh pussi win lose shit like man leav,1,142,30,3.7666666666666666,0,Unknown
4573,emergency plan,"Fort Myers, Florida",cool tip friend counterstrik secur sound,0,91,11,7.363636363636363,0,Unknown
2878,damage,"New Haven, Connecticut",tor tor situat onli wind damag enhanc word key imo,1,80,14,4.785714285714286,0,Unknown
4293,drowning,,man save drown squirrel absolut inc,0,117,14,7.357142857142857,0,Unknown
