id,keyword,location,text,target,num_char,num_words,avg_word_length,num_hashtags,country
3738,destroyed,USA,black eye 9 space battl occur star a74 involv 3 fleet total 3945 ship 17 destroy,0,106,19,4.631578947368421,0,United States
853,bioterror,,world feel long transport bioterror germ wake anthrax lab mishap,0,106,15,6.066666666666666,1,Unknown
10540,windstorm,"Palm Beach County, FL",realiti train train fall lev track sure windsor parad em,1,105,12,7.833333333333333,2,Falkland Islands (Malvinas)
5988,hazardous,USA,taiwan grace expect larg rock tree mud unstabl and/or saturn land slide veri hazard hillymountain area,1,133,19,6.052631578947368,1,United States
6328,hostage,Australia ,new isi video isi threaten behead croatian hostag 48 hour talvac tlvfacesauspol,1,125,17,6.411764705882353,1,Australia
6669,landslide,Scotland,freebesieg martinmj22 yugo tori landslid possibl mean wafer thin major g,1,140,17,7.294117647058823,2,Unknown
9772,trapped,New York City,billionair plan free half billion dollar trap venezuela year report,0,139,19,6.2105263157894735,0,Unknown
10361,weapons,Multinational *****,old testimoni weapon use promot conflict tactic corrupt infil group,0,146,18,7.055555555555555,0,Unknown
1953,burning buildings,Los Angeles,ali fli plane run burn build whi soup man child booradleyvancullen,0,115,19,5.105263157894737,1,Unknown
9586,thunder,,thunder shake hous wake sister car alarm,1,73,15,3.933333333333333,0,Unknown
8010,refugees,Ad Majorem Dei Glorium,polic monitor 200 jihad poland,1,82,9,8.222222222222221,0,Unknown
7725,panicking,UK,dad panic weight loss mean need hurri new cloth fundwhen reach goal,0,114,24,3.75,0,Ukraine
9221,suicide bombing,GCC,allen driver kuwait attack join dash day befor june 26 suicid bomb confess court,1,138,21,5.619047619047619,1,Unknown
1774,buildings on fire,New Hampshire,video fire burn apart build blow car manchest,1,96,13,6.384615384615385,0,Unknown
8621,seismic,,thank benson clegg follow check map,0,88,13,5.846153846153846,2,Unknown
1710,bridge collapse,,mexico construct bring collap killion,1,96,8,11.125,0,Unknown
4511,emergency,Phoenix,god forbid anyon famili know answer phone need new emerg contact,0,90,17,4.352941176470588,0,Unknown
1480,body bags,Oklahoma City,icom 2015 summer contrast candi color topknot cross bodi tote shoulder bag womengirl icom zip po,0,132,19,6.0,0,Unknown
10628,wounded,USA,abc news polic offic wind suspect dead exchang shoot news,1,105,14,6.571428571428571,1,United States
7849,quarantined,"Cumming, GA",credit new content polic effect mani horribl subreddit ban quarantin,0,137,15,8.2,0,Gabon
10195,violent storm,,storm blitz travel citi disrupt manag brief seminar violent summer storm blitz tra,1,135,16,7.5,0,Unknown
1146,blight,,theda kick antiblight loan effort memphi,0,95,10,8.6,0,Unknown
9195,suicide bombing,"Minority Privilege, USA",usual d onc chop head throw gay rooftop suicid bomb start,1,141,20,6.1,0,United States
1799,buildings on fire,Brisbane Australia,fire hazard assoc instal noncompli exter cloth highris build insur aust,0,140,17,7.294117647058823,0,Unknown
3682,destroy,,friend destroy hour mao,0,80,12,5.666666666666667,0,Unknown
3855,detonation,,dorman 917033 ignit knock devon sensor connector,1,105,9,10.777777777777779,0,Unknown
1815,buildings on fire,"Boston, MA",threealarm fire destroy resid build car manchest nh sunday afternoon,1,119,15,7.0,0,Dominica
256,ambulance,"Cambridge, MA",new nanotech devic target destroy blood clot,0,89,13,5.923076923076923,0,Dominica
455,armageddon,,love truelov roman voodoo deduct astrolog r lot 911 apocalyp armageddon 1008pla,0,133,15,7.866666666666666,11,Unknown
7136,military,,lot 20 tom clanci militari mysteri novel paperback tomclanc,0,90,12,6.583333333333333,1,Unknown
5128,fatal,"Laredo, TX",petit master fatal frame 1 windwakerstyl self mode,0,69,11,5.363636363636363,0,Unknown
9001,stretcher,Florida,restor vinyl look new,0,100,13,6.769230769230769,0,Unknown
3936,devastated,"Port Orange, FL",aaaaaaallll season devant,1,95,16,5.0,0,Falkland Islands (Malvinas)
9611,thunderstorm,Jupiter,usnwsgov special weather statement issu august 05 1040pm edt news strong thunderstorm impact,1,136,17,7.0588235294117645,1,Unknown
6414,hurricane,New York,cluedo turbin hurrican h bluetooth 41 wireless stereo headphon headset bulk,0,139,16,7.75,0,Unknown
7179,mudslide,"Holly Springs, NC ",mudslid,1,25,3,7.666666666666667,0,New Caledonia
10630,wounded,Wherever I'm needed,small bag wound hero shake sen bean fall goan surpris shake pouch onc,0,139,26,4.384615384615385,0,Unknown
9207,suicide bombing,,suicid bomb local fremont,1,77,7,10.142857142857142,1,Unknown
5165,fatalities,"New York City ,NY",let fraction vital need fatal break duc econom,0,123,18,5.833333333333333,2,Unknown
7976,razed,,late home raze northern california wildfir,1,108,12,8.083333333333334,0,Unknown
8361,ruin,,trna ruin life,0,38,6,5.5,0,Unknown
6372,hostages,,news hostag libya india terror africa ap ts sri news tri bjp,1,143,18,6.666666666666667,13,Unknown
912,bioterrorism,,ugli 2 ugli flat bioterrorismim s d u tower noth home,1,138,18,6.722222222222222,0,Unknown
1961,burning buildings,"Copenhagen, Capital Region of Denmark",dog render kitten burn build,1,92,9,9.222222222222221,0,Unknown
2803,cyclone,United Kingdom,aww babi walter rewatchingthepilot teamscorpion cyclon,0,60,6,9.166666666666666,3,United Kingdom
5982,hazard,ilford,fair good attack winger prem hazard william basic start everi game 100,0,128,24,4.375,0,Unknown
10859,nan,,break la refugia oil spill costlier big project,1,99,13,6.6923076923076925,2,Unknown
5262,fear,"Chippenham/Bath, UK",fear factor decemb deal,0,36,6,5.166666666666667,0,Ukraine
1156,blight,UK & Ibiza,track blight thank follow,0,41,7,5.0,0,Unknown
7990,razed,San Diego California 92101,home raze northern calf wildfir santiago,1,100,10,9.1,1,Unknown
6658,landslide,"Dundee, UK",armi veteran fear loo rock dunde landslid kill moment face hail bullet,1,139,22,5.363636363636363,0,Ukraine
1683,bridge collapse,Wiltshire,fuck trent bring remind england collaps caribbean,1,117,22,4.318181818181818,0,Unknown
1804,buildings on fire,Reading UK,band build fire play wednesday rug,0,139,16,7.75,1,Unknown
5408,fire truck,,township fire truck use philippin langley time filipino,0,101,13,6.846153846153846,1,Unknown
9455,terrorism,Earth 0,omega man writer explor terror religion epic kyle rayner stori,0,114,15,6.666666666666667,0,Unknown
4507,emergency,New York,surviv kit whistl fire starter wire cree torch emerg blanket s knife,0,139,18,6.722222222222222,0,Unknown
10776,wreckage,India,wreckag conclud confirm mh370 malaysia pm,1,60,8,6.625,0,India
9629,thunderstorm,"Oklahoma City, OK",sever thunderstorm warn cancel central oklahoma expect 50 mph wind penni size hail,1,112,17,5.647058823529412,0,Cook Islands
5236,fatality,New York ,fatal,0,33,2,16.0,0,Unknown
5713,forest fire,Shelby County,ad video playlist ori bind forest ep 6 fire death,1,107,19,4.684210526315789,0,Unknown
3414,derail, Road to the Billionaires Club,gm pray attack enemi 2 derail ur destini block lord flood ur life heaven bless,1,142,26,4.5,0,Unknown
5336,fire,,fire way close wwf,1,70,12,4.916666666666667,0,Unknown
3513,derailment,"Chicago, IL 60607",box alarm train derail calm strike order 2121 chicagoscann,1,116,20,4.85,1,Unknown
7426,obliterated,"1313 W.Patrick St, Frederick",drunk meal 101 cook total obit,0,84,11,6.7272727272727275,0,Unknown
3982,devastation,,70 year atom bomb japan struggl war past anniversari devant wrought b,1,135,19,6.157894736842105,0,Unknown
6767,lightning,"Leesburg, FL",woolworth trout singl middl fourth hit night altamont spring,0,92,16,4.8125,0,Falkland Islands (Malvinas)
8321,rubble,Spain - China - Latin America.,china stock market crash gem rubbl china stock market crash summer h,0,138,20,5.95,0,Unknown
1968,burning buildings,"Epic City, BB.",pledg alleg pope burn build epic citi,1,82,14,4.928571428571429,0,Unknown
247,ambulance,Jackson,twelv fear kill pakistani air abul helicopt crash,1,110,11,9.090909090909092,0,Unknown
5995,hazardous,Far Away From Home,agent dangl pier crystal potent hazard eye,0,78,11,6.181818181818182,0,Unknown
2051,casualties,"Absecon, NJ",civilian casualti afghanistan hit high number sinc 2009 un,1,120,15,7.066666666666666,1,Unknown
8574,screams,,light recent event like scream year,0,77,16,3.875,0,Unknown
8236,riot,Seattle,southeast dirt riot seri crown champion southeast dirt riot seri crown championsblackfoot d,0,135,16,7.4375,0,Unknown
10708,wreck,,emit wreck right,0,33,6,4.666666666666667,0,Unknown
1670,bombing,United States,japan mark anniversari hiroshima atom bomb general,1,92,10,8.3,1,United States Minor Outlying Islands
10445,wild fires,,great footag strong work san bernardino counti fire work wild fire right,1,137,21,5.571428571428571,0,Unknown
7267,nuclear disaster,,peopl tweet care japan fukushima nuclear disea problem ignor problem,1,124,21,4.9523809523809526,2,Unknown
509,army,"Memphis, TN",salt armi host ralli reconnect father child salt armi host school ralli,1,141,20,6.1,0,Bhutan
2594,crash,,dat liabl fuck crash,0,45,11,3.1818181818181817,0,Unknown
5763,forest fires,"Boise, Idaho",852015 430 pm progress boi forest fire,1,111,14,6.928571428571429,0,Unknown
4039,disaster,"Alexandria, VA",technolog let human surviv environ disea,0,95,11,7.7272727272727275,0,Latvia
8945,storm,"State College, Pa",typhoon soudelor captur inc nasa photo way taiwan,1,128,16,7.0625,0,Pakistan
6105,hellfire,?????? ??? ?????? ????????,allah describ pile wealth think fore rescript peopl hellfir sarah humana reflect,0,138,22,5.318181818181818,5,Unknown
6794,lightning,"State College, PA",check amaz footag light film lift chicago,0,130,15,7.733333333333333,0,Pakistan
4667,engulfed,UK,tube strike live late travel updat london engulf inch,1,117,13,8.076923076923077,0,Ukraine
1251,blood,canberra,noth day noth excel porridg peopl blood orang porridg phenomena,0,114,14,7.214285714285714,0,Unknown
5127,fatal,Varanasi,11yearold boy charg manslaught toddler report 11yearold boy charg manslaught fatal sh,1,136,20,5.85,0,Unknown
6920,mass murderer,"Haysville, KS",hillari mass murder,1,48,5,8.8,0,Unknown
6668,landslide,Europe,late landslid kill near venic heavi rain,1,81,10,7.2,0,Unknown
10336,weapons,"California, United States",kick hendrixonfir big noon conquest mix map weapon violet dr limit server max 3,0,122,20,5.0,1,United States Minor Outlying Islands
1275,blood,,shed blood son daughter land pollut psalm 10638 help stop sin abort,0,119,21,4.666666666666667,0,Unknown
10342,weapons,"GrC Founder, 8,000 Subscribers",weapon steal nation guard armori new albania miss,0,102,13,6.923076923076923,1,Unknown
9499,terrorist,,medium pakistan cover captur terrorist mohan,1,101,13,6.846153846153846,0,Unknown
2629,crashed,,pakistan armi helicopt crash countri restiv northwest kill 8,1,114,15,6.666666666666667,0,Unknown
5848,hailstorm,Calgary,love summer calgari myc rainstorm crazyweath,1,84,9,8.444444444444445,5,Unknown
7670,panic,"Palm Bay, FL (Kissimmee)",panic patient alabama test neat bola,1,79,10,6.9,0,Unknown
6244,hijacking,Mongolia,hot antenna hijack comput send datum sound wave black hat 2015 firebreak good,1,119,16,6.4375,3,Mongolia
2947,danger,"Kansas City, MO",danger ok rest danger,0,95,17,4.647058823529412,0,Macao
8556,screams,New Jersey,hit tailor fuck doubl play kay scream rob hit,0,80,17,3.764705882352941,0,Unknown
1827,burned, Nxgerxa,burn popcorn,0,19,3,5.666666666666667,0,Unknown
7474,obliteration,,remov trace cometh obit,0,78,10,6.9,0,Unknown
994,blazing,State of Georgia,realli sad come expect ibama,0,105,15,6.066666666666666,0,Unknown
3611,desolation,,esol run free till 87 militari thriller suspend kind read,0,139,14,9.0,6,Unknown
1647,bombing,,anniversari hiroshima atom bomb mark,1,75,8,8.375,0,Unknown
3102,deaths,Top secret bunker ,pls reduc cyclist death compulsori highway code test everi vehicl use road notrocketsci,1,140,21,5.714285714285714,1,Unknown
10067,typhoon,ngapain?,ibama declar disea typhoondevast sapan ibama sign disea declar northern marian,1,136,15,8.133333333333333,0,Unknown
4201,drowned,Financial News and Views,hund fear drown migrant boat capsiz libya,1,81,10,7.2,0,Unknown
3689,destroy,"Paulton, England",wow convinc compel evil chang view climat chang deni tend destroy givingevid,0,143,22,5.545454545454546,0,Unknown
2711,crushed,,wrap tv compani share crush disney disappoint,0,119,12,9.0,0,Unknown
4548,emergency plan,"Antioch, CA ",4 printabl emerg plan templat,0,60,6,9.0,0,Central African Republic
8815,sirens,Sydney,marketforc perth winner siren round 2 ninet non buffer cat shark radio spot,0,118,17,6.0,0,Unknown
7756,police,"anzio,italy",4 polic offic arrest bus child policeman boot camp san li crisp calf,1,129,19,5.842105263157895,0,Unknown
4984,explosion,"Chicago, IL",genius tear wor correct expo n pain day day right,0,92,16,4.8125,0,Israel
5733,forest fire,Western Washington,use acronym unit state fire servic,0,70,9,6.888888888888889,0,Unknown
985,blazing,New York,morgan silver dollar 1880 s gem bu dml cameo rev blaze ms high grade read,0,139,20,6.0,0,Unknown
2916,danger,"Brooklyn, NY",away preserv park r impost danger african peopl imagin,0,125,18,5.944444444444445,0,Unknown
3193,deluge,"Fort Fizz, Ohio",inc mcmahon onc billionair remem read delug post inc mcmahon lose 350 m,0,136,20,5.85,0,Unknown
9760,trapped,"London, England",feel trap innit,0,39,6,5.666666666666667,0,Unknown
8952,storm,,kesabaran membuahkan basil ndah pad sit teat life int wait storm pass learn danc rain,1,138,24,4.791666666666667,0,Unknown
7573,outbreak,"ÌÏT: 6.488400524109015,3.352798039832285",famili sue legionnair 40 famili affect fatal outbreak legionnair dista,1,136,18,6.611111111111111,0,Unknown
9212,suicide bombing,Istanbul,infograph 20 turkish secur offic kill pkk isi terror attack sinc sure suicid bomb,1,140,19,6.421052631578948,0,Unknown
3302,demolish,Bagalkote Karnataka ,charm demolish fall state engin opinion telangana,0,84,12,6.0,2,Unknown
6542,injury,"Houston, TX",texan hope wrong radio houston starter foster injuri,0,95,16,5.0,0,Unknown
4813,evacuation,"Portland, Oregon",break author issu new mandatori notic 25 home north fire roosevelt wa,1,122,20,5.15,2,Unknown
5174,fatalities,Official Website,hse releas annual workplac fail datum look,0,107,12,8.0,1,Unknown
9053,structural failure,Bukittinggi  ?? Sumatera Barat,invest fatal virgin palac spaceship crash year structur failur,1,136,18,6.611111111111111,0,Unknown
2501,collided,,cyclist collid runner rook greenway win 300000 civil verdict rook time cyclist c,1,136,19,6.2105263157894735,0,Unknown
3696,destroy,,eat metal kc ratingbut think like destroy stori rate,0,126,21,5.0476190476190474,0,Unknown
1452,body bagging,,ovofest drake straight bodi bag meek ono stage ziphimup,0,71,11,5.545454545454546,2,Unknown
10795,wrecked,"Santa Cruz, CA",israel wreck home want land,1,71,10,6.0,0,Central African Republic
10433,whirlwind,Atlanta - FAU class of '18,past week absolut whirlwind bind,1,62,10,5.3,0,Unknown
3897,detonation,,ignit knock devon sensorsenso standard s11,0,101,8,11.75,0,Unknown
4103,drought,"Spokane, WA",worri drought affect extrem weather doe dampen econom,1,118,17,6.0,0,Botswana
1943,burning buildings,"New Orleans ,Louisiana",burn build medium outrag,1,56,5,10.4,0,Unknown
7498,oil spill,,refugia oil spill costlier big project plain american pipelin oil spill,1,135,20,5.8,0,Unknown
6630,inundated,,wither death album find undermin backyard becau cat anund floor muster cat food,0,133,21,5.380952380952381,0,Unknown
7031,mayhem,,slayer reflect low mayhem festiv attend king diamond jeff hahnemann pass,0,115,14,7.285714285714286,0,Unknown
5944,hazard,"Lancashire, United Kingdom",like video battlefield 4 funni moment duke hazard undergo soldier,0,128,18,6.166666666666667,0,United Kingdom
7626,pandemonium,Dallas Fort-Worth,pandemonium aba woman delia babi face photo,0,88,12,6.416666666666667,0,Unknown
8032,refugees,,turkish coupl spend d day feed 4000 syrian refug turkish coupl marri,0,131,20,5.55,0,Unknown
10744,wreckage,Mumbai,wreckag conclud confirm mh370 malaysia pm invest famili,1,136,17,7.0588235294117645,0,Unknown
7453,obliteration,"Elizabeth, NJ",oh teamhennessi nj obit round 1 happi birthday colombian festiv,0,125,13,8.615384615384615,2,Unknown
10301,weapon,"Halifax, NS, Canada",use weapon caus screw xd,0,77,14,4.571428571428571,0,Canada
1818,buildings on fire,"Oklahoma City, OK",hinton citi offic confirm multipl build fire current peopl main street way,1,125,19,5.631578947368421,0,Cook Islands
4699,epicentre,,question anybodi el problem 7 circl epicentr,0,103,14,6.428571428571429,0,Unknown
998,blazing,Lima-Peru,oh heart race temperatur blaze roof videoveranomtv fifth harmoni,0,95,15,5.4,1,Unknown
7416,obliterated,,destroy zimmerman fan club twitter obit renew reduc sock acc,0,139,20,6.0,1,Unknown
4393,earthquake,London,small earthquak la worri emma possum fine,1,72,14,4.214285714285714,0,Unknown
10609,wounded,,love weapon wound general ltd,0,52,9,4.888888888888889,0,Unknown
9729,tragedy,dubai ,cour 8 minut b4 tragedi noth train cos place n flash flood caus wash track,1,134,21,5.0476190476190474,0,Unknown
1637,bombing,,congrat captur besieg citi 3 month indiscrimin bomb land air,1,140,19,6.421052631578948,0,Unknown
8180,rescuers,worldwide,video pick bodi water rescuer search hund migrant mediterraneo,1,136,18,6.611111111111111,0,Unknown
7971,razed,WorldWide,news late home raze northern california wildfir new york time tap cl100,1,122,18,5.833333333333333,3,Unknown
4332,dust storm,Near Yosemite,6 thing catch dust storm challeng real estat market common video,0,129,20,5.5,0,Unknown
7883,quarantined,,credit new content polic effect mani horribl subreddit ban quarantin,0,137,15,8.2,0,Unknown
3674,destroy,Trackside California,wow crackdown 3 use multipl server multi lie u destroy build cop,0,98,14,6.071428571428571,1,Unknown
9018,stretcher,,sweater stretcher,0,63,4,15.0,0,Unknown
1728,buildings burning,,live matter fan burn build steal neighbor protest,1,119,19,5.315789473684211,0,Unknown
5175,fatalities,#WashingtonState #Seattle,settl dead red light runner intersect reveal,1,85,8,9.5,1,Unknown
3750,destruction,All Around the World,help save beauti town ontario district power plant develop,0,117,18,5.5,0,Unknown
9218,suicide bombing,Principality of Zeron,christian terrorist sure suicid bomb employ islam group,1,128,22,4.863636363636363,0,Unknown
4164,drown,,onli u let drown,0,43,9,3.888888888888889,0,Unknown
2220,chemical emergency,"Seattle, Washington",new job open downtown emerg servic center seattl chemic depend counsellor intern job,0,138,18,6.722222222222222,5,Unknown
9468,terrorism,Planet Earth,dom terror great,0,94,14,5.785714285714286,0,Unknown
1676,bridge collapse,"New Delhi, Delhi",ash 2015 australia collaps trent bring bad histori england bundl australia 60,1,138,19,6.315789473684211,0,Unknown
7813,quarantine,"ÌÏT: 40.707762,-74.014213",annand geddit quarantin content,0,80,9,8.0,0,Unknown
5180,fatalities,,wonder coolweird till look charact mix fatal skinless predat,0,106,19,4.631578947368421,0,Unknown
3122,debris,,mh370 debri find reunion island sad tragedi crash mh370,1,79,12,5.666666666666667,5,Unknown
2154,catastrophe,,human histori becom race duc catastroph,0,77,12,5.5,0,Unknown
10333,weapon,,servic section lurk weapon,0,56,11,4.181818181818182,0,Unknown
7913,rainstorm,Alberta ,wow beauti lie everi storm today rainstorm ab pipelin,1,115,16,6.25,0,Unknown
560,arson,Jerusalem,mourn notic stab arson victim stir polit grief israel,1,105,13,7.153846153846154,0,Unknown
9912,trouble,YA MOTHA BED,funni caus dumb ass young n troubl lol,1,85,17,4.0588235294117645,0,Unknown
531,army,,abbey pick fan armi beehiv,0,88,10,7.9,1,Unknown
9267,sunk,,onc time fact decid univel 7 hour away actual sink,0,90,19,3.789473684210526,0,Unknown
3425,derail, Road to the Billionaires Club,gm pray attack enemi 2 derail ur destini block lord flood ur life heaven bless,0,140,26,4.423076923076923,0,Unknown
7707,panicking,Oxford / bristol,okay panic,0,23,5,3.8,0,Unknown
4003,disaster,Portoviejo-Manabi-Ecuador,disea,0,40,4,9.25,0,Unknown
10040,twister,,tornado el nino canada twister season boost toronto,1,91,12,6.666666666666667,1,Unknown
10202,violent storm,Kenya,slow clap pilot drama video plane land sure violent storm,1,104,14,6.5,0,Kenya
3108,debris,,confirm debri mh370,1,34,6,4.833333333333333,0,Unknown
9012,stretcher,Florida,homemad frozen yogurt pop luck,0,105,12,7.833333333333333,0,Unknown
5790,hail,,np aveng sevenfold hail king,0,40,8,4.125,1,Unknown
10516,wildfire,Washington State,wildfir near columbia river town 50 percent contain firm wa,1,117,13,8.076923076923077,2,Unknown
6241,hijacking,"South Pasadena, CA",exampl use wor caf tri market whashtag hijack,0,109,19,4.7894736842105265,0,Central African Republic
5595,flood,New York,spot flood combo inch r3000 curv cree lead work light bar x4 road fog lamp,0,139,20,6.0,0,Unknown
3436,derail,,dozen dead train derail river india,1,98,12,7.25,0,Unknown
9833,trauma,The Jewfnited State,whi marijuana critic research treat psd hempel cannabi marijuana,0,141,14,8.785714285714286,5,Unknown
9110,suicide bomb,Email: Lovethterry@gmail.com,ayr old pkk suicid bomber devon bomb turkey armi trench,1,138,18,6.722222222222222,0,Unknown
2212,chemical emergency,Center for Domestic Preparedness,fear center diseas prepar week long train chemic biolog radiant nuclear emerg respond,1,130,17,6.588235294117647,0,Unknown
493,armageddon,#FLIGHTCITY UK  ,offic vid thermal gtgtgt gtgtgt gtgtgt armageddon come soon,0,122,11,10.181818181818182,2,Unknown
598,arsonist,ss,hate white peopl mo,1,47,7,5.857142857142857,0,Brunei Darussalam
10693,wreck,Pratt-on-Wye,mani car cyclist wreck past scratch pedal ban news,0,102,17,5.0588235294117645,1,Unknown
9612,thunderstorm,,sever thunderstorm warn issu august 05 931pm cdt august 05 1015pm cdt news,1,119,18,5.666666666666667,0,Unknown
4159,drown,@notoriousD12,throw water drown word choke,0,90,16,4.6875,0,Unknown
4068,displaced,Pedophile hunting ground,pot strategicpati strategi genocid refug idp intern display peopl horror etc,1,134,15,8.0,2,Unknown
8575,screams,,follow cannon contain scream joy thankyou,0,97,15,5.533333333333333,1,Unknown
3588,desolate,,psalm 3422 lord redeem soul servant trust shall esol,0,111,21,4.333333333333333,0,Unknown
10492,wildfire,Amsterdam | San Francisco,hearth burn like wildfir bee knee,1,78,11,6.181818181818182,0,Unknown
3968,devastation,"Upper manhattan, New York",70 year atom bomb japan struggl war past anniversari devant wrought b,1,135,19,6.157894736842105,0,Unknown
159,aftershock,304,hard conflict glorious triumph thoma pain,0,69,11,5.363636363636363,0,Unknown
5845,hailstorm,"Calgary, Alberta",rainstorm day 2 round myc yycstorm,1,79,8,9.0,3,Unknown
563,arson,"Milwaukee, WI",owner chicagoarea gay bar admit arson scheme lgb,0,107,13,7.3076923076923075,1,Malawi
10710,wreck,new york,act age mess everyon wild fun video wreck,0,74,18,3.1666666666666665,0,Unknown
8125,rescued,The green and pleasant land.,whi africa onc rescu news,1,59,10,5.0,1,Unknown
6930,mass murderer,Earth,suit surpris hear face belong noth democrat massmurd,1,139,24,4.833333333333333,0,Unknown
2648,crashed,International ,tt today news bin laden famili plane crash avoid microlight land far runway,1,132,18,6.333333333333333,0,Unknown
10305,weapon,Central Florida,break ibama offic muslim terrorist weapon use tea attack,1,102,13,6.923076923076923,0,Unknown
3914,devastated,London,richmond coach devant hear death second driver mr chanc sit jam,1,139,20,6.0,0,Unknown
3721,destroyed,,russian custom destroy total 319 ton food today phew italian meat burn inner pulkovo airport,0,134,23,4.869565217391305,0,Unknown
7400,obliterated,New York,obit,0,11,1,11.0,0,Unknown
1224,blizzard,,sean end career sg blizzard vs knockout,0,66,9,6.444444444444445,0,Unknown
92,ablaze,"Calgary, AB",non play rene ablaz ian buff magnitud erm,0,80,10,7.0,2,Aruba
9493,terrorist,Iraq|Afghanistan| RSA |Baghdad,natur rubric metrofmtalk,0,43,3,13.666666666666666,1,Unknown
1956,burning buildings,,ah yes gay total destroy america build burn meteor crash school wow,0,113,19,5.0,0,Unknown
3549,derailment,"Palo Alto, California",consent order cleanup underway cox derail site knoxvill news sentinel,1,128,15,7.6,0,Unknown
7407,obliterated,,watch seventi terror episod iran alway hate want obit,1,128,18,6.166666666666667,0,Unknown
354,annihilation,Spain,start stagnant 3 planetari nihil,1,85,8,9.75,0,Spain
6731,lava,"Bandar Lampung, Indonesia",lava blast dan power red pantherattack,1,73,9,7.222222222222222,1,Indonesia
7908,radiation emergency,#MayGodHelpUS,cot cot radial nuclear emerg track center,0,105,9,10.555555555555555,3,Unknown
2076,casualty,,predict disconnect social casualti favourit peopl like,1,91,14,5.571428571428571,0,Unknown
5695,floods,,child myanmar face doubl catastroph flood hit,1,97,14,6.0,0,Unknown
3842,detonate,"Orlando, FL",hip hop news india apollo brown devon ft mop lta ref,1,126,13,8.76923076923077,3,Falkland Islands (Malvinas)
4020,disaster,"Hinton, W.Va.",jeff lock train wreck fin diseas fortun pirat acquir qualiti starter ja oh wait blowltan,1,123,19,5.526315789473684,1,Unknown
10851,nan,,news issu sever thunderstorm warn ar nc ok expect trauma case,1,134,18,6.5,5,Unknown
10487,wildfire,Get our App,fire pisa nation forest grow 375 acr soc charlott,1,89,13,5.923076923076923,0,Unknown
9559,thunder,"Enfield, UK",illusori icarus non play check,0,60,6,9.166666666666666,0,Ukraine
4879,explode,The Windy City,crash queen die cometh explod know,1,101,15,5.533333333333333,0,Unknown
1031,bleeding,"Rockford, IL",throw chicken nugget sister lip blue,0,64,12,4.416666666666667,0,Israel
8623,seismic,Somalia,oil gas explor seismic shift gabon somalia bloomberg somalia,1,116,16,6.3125,2,Somalia
9636,thunderstorm,,sever thunderstorm warn includ russellvil ar clarksvil ar darnel ar 1015 pm cdt,1,124,15,7.333333333333333,0,Unknown
